1,Xin Doi Co Doi            ,My Tam2,999 Doa Hong                 ,Minh Tuyet3,Ai Bao Em La Giai Nhan       ,Gia Huy4,Ai Biet                      ,Thanh Mai5,Ai Bieu Anh Lam Thinh        ,Yen Phuong6,Ai Buon Hon Ai               ,Tam Doan7,Ai Cho Tinh Yeu              ,Che Linh8,Ai Cho Toi Tinh Yeu          ,Bruce Doan9,Ai Den Sai Gon               ,Ly Hai;Thanh Thao10,Ai Di Ngoai Suong Gio        ,Diep Thanh Thanh11,Ai Dua Em Ve                 ,Dam Vinh Hung12,Ai Dua Em Ve                 ,Le Toan13,Ai Dua Em Ve                 ,Ngoc Lien; Luong Tung Quang14,Ai Kho Vi Ai                 ,Huong Lan15,Ai Len Xu Hoa Dao            ,Hoang Oanh; Trung Chinh16,Ai Nho Chang Ai              ,Huong Lan17,Ai Nho Chang Ai              ,Quang Le18,Ai Noi Voi Em                ,Song Ca19,Ai Noi Yeu Em Dem Nay        ,Tuan Vu20,Ai Ra Xu Hue                 ,Quang Le; Ngoc Ha21,Ai Se Biet Truoc             ,Ngoc Anh; Quoc Hung22,Ai Se Yeu Em                 ,Phuong Thanh23,Ai Ve Song Tuong             ,Anh Khoa24,Ai Ve Song Tuong             ,Man25,Ai Ve Song Tuong             ,Nguyen Hung26,Ai Ve Voi Toi                ,Tran Duc27,Aline Goi Ten Nguoi Yeu      ,Man28,Am Tham                      ,Hai Ly29,Am Tham                      ,Thuy Tien30,An Nan Muon Mang             ,Hong Ngoc31,An Nan                       ,Ngan Hue; Che Phong32,An Tinh Mong Manh            ,La Suong Suong33,Ang May Buon                 ,Cam Ly34,Anh Biet Em Di Chang Tro Ve  ,Vu Khanh35,Anh Chang Da Nghi            ,Chau Gia Kiet36,Anh Chi La Hinh Bong Cua Nguoi Khac,Lam Vu37,Anh Chi Yeu Em               ,Le Toan38,Anh Cho Em Mua Xuan          ,Lam Thuy Van39,Anh Cho Em Mua Xuan          ,Quang Linh40,Anh Chon Theo Quen Lang      ,Nhat Trung; La Suong Suong41,Anh Co Quen Em               ,Cam Ly; Van Quang Long42,Anh Con Nho Que Huong        ,Nha Thanh43,Anh Con No Em                ,Gia Huy44,Anh Cu Biet                  ,Gia Huy45,Anh Cu Hen                   ,Nhu Quynh46,Anh Da Quen Mua Thu          ,Female47,Anh Da Quen Mua Thu          ,Luu Bich; Nhu Quynh; Khanh Ha48,Anh Da Thay Mua Xuan Chua    ,Don Ho49,Anh Da Thay Mua Xuan Chua    ,Thien Kim50,Anh Dau Em Do                ,Mai Le Huyen51,Anh Den Mau                  ,Female52,Anh Di Chien Dich            ,Hoang Oanh53,Anh Di Ve Noi Dau            ,Yen Phuong54,Anh Dung Co Lo               ,Hung Cuong; Mai Le Huyen55,Anh Hung Xa Dieu             ,Tuan Dat; Lucia Kim Chi56,Anh Khong Chet Dau Anh       ,Lam Nhat Tien57,Anh Khong Chet Dau Anh       ,Thanh Lan58,Anh Khong Con Gi De Noi Voi Em,Lam Chan Huy59,Anh Khong Lai                ,Thanh Truc60,Anh Khong Muon Bat Cong Voi Em,Ung Hoang Phuc; Hat61,Anh Khong Muon Lam Nguoi Thu Ba,Lam Chan Huy62,Anh Khong Muon Ra Di         ,Nguyen Phi Hung63,Anh Khong The Quay Lai Voi Em,Pham Khanh Hung64,Anh Khong The Yeu Hai Nguoi  ,Luu Chi Vy; May Trang65,Anh La Nguoi Co Loi          ,Lam Vu66,Anh La Tia Nang Trong Em     ,Lam Thuy Van67,Anh Mo Ve Em                 ,Dam Vinh Hung68,Anh Mo Ve Em                 ,Le Toan69,Anh Mong Em Quay Ve          ,Khanh Dang70,Anh Mong Em                  ,Duy Manh71,Anh Muon Dung Cuoc Choi      ,Lam Chan Khang72,Anh Muon Noi Yeu Em          ,Quang Dung73,Anh Nho Em Nhieu             ,Lam Truong74,Anh Nho Khong Anh            ,Ha Vy75,Anh Sang Cua Doi Toi         ,Chord Gm76,Anh Sang Cua Doi Toi         ,Luu Bich77,Anh Sang Doi Toi             ,Thu Minh78,Anh Sao Buon                 ,My Tam79,Anh Se Den                   ,Quang Dung80,Anh Se Nho Mai               ,Bang Kieu81,Anh Thi Khong                ,Minh Tuyet82,Anh Tien Tuyen Em Hau Phuong ,Nhu Quynh; Truong Vu83,Anh Tin Minh Da Cho Nhau Ky Niem,Thu Thuy; Luong Bang Quang84,Anh Trang Le Loi             ,Loan Chau85,Anh Trang Le Loi             ,Tam Doan86,Anh Trang Tan                ,Duy Khiem87,Anh Trang Tan                ,Ha Vy88,Anh Trang Tan                ,Thai Chau89,Anh Trang Xua                ,Nhat Tinh Anh90,Anh Va Em Deu Co Loi         ,Luu Chi Vy91,Anh Van Biet                 ,Dam Vinh Hung92,Anh Van Cho Em               ,Dam Vinh Hung93,Anh Van Con Yeu Em           ,Phan Dinh Tung94,Anh Van Khong Doi Thay       ,Le Toan95,Anh Van Mo Ve Em             ,Johny Dung96,Anh Vang Biet                ,Dam Vinh Hung97,Anh Ve Voi Em                ,Tuan Vu; Nhu Mai98,Anh Xin Lam Co Dai           ,Quang Dung99,Anh Xin Ra Di                ,Nguyen Hoang Nam100,Anh Yeu Em Van Cho           ,Lam Thai Uyen101,Anh                          ,Le Toan102,Anh                          ,Tran Tam; My Le103,Ao Anh                       ,Female104,Ao Anh                       ,Quang Dung; Thanh Thao105,Ao Anh                       ,Y Lan106,Ao Cuoi Khong Nang Dau       ,Truong Vu107,Ao Cuoi Mau Hoa Ca           ,Phi Nhung108,Ao Dai Viet Nam              ,Vu Khanh109,Ao Dep Nang Dau              ,Huong Lan110,Ao Dep Nang Dau              ,Truong Vu111,Ao Em Chua Mac Mot Lan       ,Bruce Doan112,Ao Em Chua Mac Mot Lan       ,Truong Vu113,Ao Em Chua Mac Mot Lan       ,Vu Tuan114,Ao Lua Ha Dong               ,Le Toan115,Ao Lua Ha Dong               ,Y Lan116,Ao Lua Vang                  ,Khanh Ly117,Ao Mong Tinh Yeu             ,"Dan Truon;, Cam Ly"118,Ao Nha Binh                  ,Truong Vu119,Ao Tim Ngay Xua              ,Manh Dinh120,Ao Trang Go Cong             ,Thai Chau; Ha Vy121,Ao Xanh                      ,Phi Nhung122,Au O Vi Dau Chanh Long       ,Thanh Huyen123,Ba Me Que                    ,Hai Ly; Bruce Doan124,Ba Rang Ba Ri                ,Kha Tu125,Ba Thang Quan Truong         ,Truong Vu126,Ba Thang Ta Tu               ,Phi Nhung127,Ba Thang Ta Tu               ,Truong Vu128,Bac Mau Ao Tran              ,Truong Vu129,Bac Tinh Ca                  ,Vu Tuan130,Bac Tinh                     ,Dam Vinh Hung131,Bac Tinh                     ,Female132,Bac Tinh                     ,Huy Vu133,Bac Tinh                     ,Khanh Hoang134,Bac Tinh                     ,Ngoc Son135,Bac Trang Lua Hong           ,Truong Vu136,Bai 20                       ,Khai Tuan; Chau Tuan137,Bai Ca Cho Anh               ,Son Tuyen138,Bai Ca Cho Em                ,Thai Hien139,Bai Ca Chung Minh            ,Tuan Vu140,Bai Ca Dao Dau Doi           ,Manh Quynh141,Bai Ca Dao Xot Xa            ,Lam Gia Minh142,Bai Ca Dat Phuong Nam        ,Doan Thy143,Bai Ca Dem                   ,My Tam144,Bai Ca Hai Chung Minh        ,Khanh Hoang145,Bai Ca Hanh Ngo              ,Le Uyen146,Bai Ca Hanh Ngo              ,Tuan Ngoc; Thanh Thao147,Bai Ca Ky Niem               ,Thanh Do148,Bai Ca Mua Xuan              ,Dan Truong149,Bai Ca Ngoi Que Huong        ,Thai Chau; Son Ca150,Bai Ca Ngoi Tinh Yeu         ,Loan Chau151,Bai Ca Tan Hon               ,Le Toan152,Bai Ca Tinh Nho              ,Thu Thao153,Bai Ca Tinh Nho              ,Tuan Ngoc154,Bai Ca Tuoi Tre              ,Hop Ca155,Bai Ca Xuan                  ,Khanh Hoang156,Bai Ca Yeu Doi               ,Cam Ly157,Bai Cat Tho Mong             ,Le Toan158,Bai Cuoi Cho Cuoc Tinh       ,Dam Vinh Hung159,Bai Cuoi Cho Nguoi Tinh      ,Bruce Doan160,Bai Cuoi Cho Nguoi Tinh      ,Manh Quynh161,Bai Hat Ru Mua Dong          ,Ngoc Ha162,Bai Hat Ru Mua Xuan          ,Duong Thu163,Bai Hat Ru Mua Xuan          ,Hong Nhung164,Bai Huong Ca Vo Tan          ,Che Linh; Thanh Tuyen165,Bai Khong Ten Cuoi Cung      ,Kim Anh166,Bai Khong Ten Cuoi Cung      ,Man167,Bai Khong Ten Cuoi Cung      ,Vu Khanh168,Bai Khong Ten So 01          ,Hoang Nam169,Bai Khong Ten So 02          ,Ngoc Bich170,Bai Khong Ten So 02          ,Nguyen Khang171,Bai Khong Ten So 05          ,Ngoc Bich172,Bai Khong Ten So 05          ,Vu Khanh173,Bai Khong Ten So 06          ,Duy Quang174,Bai Khong Ten So 06          ,Y Lan175,Bai Khong Ten So 07          ,Hoang Nam176,Bai Khong Ten So 08          ,Female177,Bai Khong Ten So 08          ,Nguyen Khang178,Bai Khong Ten So 09          ,Chau Dinh An179,Bai Khong Ten So 09          ,Vu Khanh180,Bai Khong Ten So 15          ,Nguyen Hung181,Bai Khong Ten So 2           ,Christiane Le182,Bai Khong Ten So 2           ,Khanh Ly183,Bai Khong Ten So 2           ,Nguyen Khang184,Bai Khong Ten So 2           ,Nini & Ha Vy; Vina Uyen Mi185,Bai Khong Ten So 37          ,Khanh Ha186,Bai Khong Ten So 4           ,Thuy Hang187,Bai Khong Ten So 4           ,Tuan Ngoc188,Bai Khong Ten So 5           ,Ngoc Bich189,Bai Khong Ten So 5           ,Phuong Nghi190,Bai Khong Ten So 5           ,Vu Khanh191,Bai Khong Ten So 6           ,Duy Quang192,Bai Khong Ten So 6           ,Y Lan193,Bai Khong Ten So 7           ,Hoang Nam194,Bai Khong Ten So 7           ,Le Tri195,Bai Khong Ten So 8           ,Vu Khanh196,Bai Khong Ten So 9           ,Vu Khanh197,Bai Luan Vu Xua              ,Elvis Phuong198,Bai Ngoi Ca Que Huong        ,Manh Hung199,Bai Ngoi Ca Que Huong        ,Thai Chau; Son Ca200,Bai Ngoi Ca Tinh Yeu         ,Loan Chau201,Bai Tango Buon               ,Luong Gia Huy202,Bai Tango Cho Em             ,Elvis Phuong; Ai Van203,Bai Tango Cho Em             ,Man204,Bai Tango Cho Em             ,Ngoc Minh205,Bai Tango Xa Roi             ,Thanh Thao206,Bai Thanh Ca Buon            ,Elvis Phuong207,Bai Thanh Ca Buon            ,Julie208,Bai Thanh Ca Buon            ,Man209,Bai Thanh Ca Buon            ,Vu Khanh210,Bai Tho Cuoi Cung            ,Y Lan211,Bai Tho Dan Ao               ,Diep Thanh Thanh212,Bai Tho Vu Quy               ,Ngoc Ho213,Bai Tinh Ca Cho Em           ,Duy Quang214,Bai Tinh Ca Cho Em           ,Man215,Bai Tinh Ca Cho Giai Nhan    ,Quang Dung216,Bai Tinh Ca Cho Ky Niem      ,Loan Chau217,Bai Tinh Ca Co Don           ,Minh Thuan218,Bai Tinh Ca Co Don           ,Truong Vu219,Bai Tinh Ca Cua Em           ,Don Ho220,Bai Tinh Ca Khong Quen       ,Ngoc Bich221,Bai Tinh Ca Khong Ten        ,Minh Tuyet222,Bai Tinh Ca Mua Dong         ,Le Thu; Da Nhat Yen223,Bai Tinh Ca Mua Dong         ,Vu Khanh224,Bai Tinh Cho Giai Nhan       ,Vu Khanh225,Bai Tinh Mo                  ,(F) Hop Ca226,Ban Dao Tien Nu              ,Phi Nhung227,Ban Mai Tinh Yeu             ,My Tam228,Ban Tinh Ca Cho Em           ,Thai Hien229,Ban Tinh Ca Dau Tien         ,Nguyen Khang230,Ban Tinh Ca Mua Dong         ,Quang Dung231,Ban Tinh Ca Mua Dong         ,Tuan Hung232,Ban Tinh Cuoi                ,Le Thu233,Ban Tinh Cuoi                ,Man234,Ban Tinh Cuoi                ,Ngoc Lan235,Ban Tinh Cuoi                ,Nguyen Khang236,Ban Tinh Cuoi                ,Nhat Tinh Anh; Khanh Ngoc237,Ban Tinh Cuoi                ,Thanh Ha238,Ban Tinh Cuoi                ,Tuan Ngoc239,Ban Toi                      ,Quang Linh240,Ban Toi                      ,The Son241,Ban Va Tien                  ,Chau Gia Kiet242,Ban                          ,Truong Vu243,Bang Khuan Chieu Mua         ,Hoang Thanh244,Bang Khuang Chieu Noi Tru    ,Quang Dung245,Banh Xe Lang Tu              ,Ac & M246,Banh Xe Lang Tu              ,Son Ca247,Bao Dem Khong Ngu            ,Female248,Bao Gio Biet Tuong Tu        ,Man249,Bao Gio Biet Tuong Tu        ,Thuy Duong250,Bao Gio Co Nhau              ,Khang Viet251,Bao Gio Em Quen              ,Manh Quynh252,Bao Gio Em Quen              ,Phi Nhung253,Bao Gio Nguoi Tro Lai        ,Dam Vinh Hung254,Bao Gio Ta Gap Lai Ta        ,Tam Doan255,Bao Gio Ta Gap Lai           ,Ha Vy256,Bao Li Xi                    ,Duc Phuong; Be Map257,Bao Long                     ,Khanh Ngoc258,Bat Chot Ta Nhin Nhau        ,The Son259,Bay Di Canh Chim Bien        ,Khanh Ha260,Bay Di Nhung Con Mua Phun    ,Ngoc Hue261,Bay Gio Con Nho Hay Khong    ,Diep Thanh Thanh262,Bay Gio Con Nho Hay Khong    ,Nguyen Khang; Diem Lien263,Bay Gio Con Yeu              ,Thanh Ha264,Bay Gio Thang May            ,Alian Ai265,Bay Gio Thang May            ,Man266,Bay Gio Thang May            ,To Chan Phong; Thanh Thuy267,Bay Gio Thang May            ,Tuan Ngoc268,Bay Ngay Doi Mong            ,Tammi Le269,Be Bang                      ,Diep Thanh Thanh270,Be Mat Nhung                 ,Van Quang Long271,Be Oi                        ,Van Quang Long272,Be Yeu                       ,Huy Vu; Rebecca Quynh Dao273,Be Yeu                       ,Manh Quynh274,Be Yeu                       ,Tuan Vu275,Ben Cau Bien Gioi            ,Cathy Dung276,Ben Cau Ngo Mong             ,Minh Ky277,Ben Cau Nho Nguoi            ,Ngoc Ho278,Ben Da Giang                 ,Huong Lan279,Ben Doi Do Trong             ,Tam Doan280,Ben Doi Hiu Quanh            ,Hoa Mi281,Ben Em Chieu Mua             ,Dan Huy282,Ben Em La Bien Rong          ,Don Ho; Anh Minh283,Ben Em La Bien Rong          ,Loan Chau284,Ben Em Mua Xuan              ,Hoai An285,Ben Em Mua Xuan              ,Lam Truong286,Ben Giang Dau                ,Bruce Doan287,Ben Giang Dau                ,Truong Vu288,Ben Hen                      ,Dinh Van289,Ben Lung Deo                 ,Elvis Phuon;g Ai Van290,Ben Nhau Dem Nay             ,Linda Trang Dai291,Ben Nhau Du Khong Co Cam Giac,Luu Chi Vy292,Ben Nhau Ngay Vui            ,Thuy Vi293,Ben Quanh Hiu                ,Nguyen Khang294,Ben Thuong Hai               ,Doanh Doanh295,Ben Thuong Hai               ,Man296,Ben Thuong Hai               ,Tai Linh; Sy Ben297,Ben Vang                     ,Cam Ly298,Ben Xuan                     ,Anh Dung299,Ben Xuan                     ,Thuy Duong300,Beo Dat May Troi             ,Kieu Hung301,Beo Dat May Troi             ,La Suong Suong302,Bi Mat Hanh Phuc             ,Dong Nhi303,Bien Can                     ,Dan Huy304,Bien Can                     ,Khanh Ha305,Bien Cho                     ,Bang Kieu306,Bien Cho                     ,Thu Phuong307,Bien Dau                     ,Phi Nhung308,Bien Dau                     ,Tam Doan309,Bien Goi                     ,My Tam310,Bien Khat                    ,Diem Lien311,Bien Man                     ,Bruce Doan312,Bien Man                     ,Nhat Truong; Dang The Luan313,Bien Man                     ,Thanh Thanh314,Bien Man                     ,Truc Quyen315,Bien Man                     ,Truong Vu316,Bien Mo                      ,Elvis Phuong317,Bien Mong                    ,Lynda Trang Dai318,Bien Nghin Thu O Lai         ,Quang Dung319,Bien Nho                     ,Dam Vinh Hung320,Bien Nho                     ,Khanh Ly321,Bien Nho                     ,Tuan Ngoc322,Bien Oi                      ,Quang Linh323,Bien Tinh Yeu                ,Cam Ly324,Bien Tinh                    ,Thanh Tuyen325,Bien Tuyet                   ,Phi Nhung326,Bien Va Em                   ,Khanh Ha327,Bien Vang Em Chieu Nay       ,Nguyen Khang328,Bien Vang                    ,Bang Kieu329,Biet Bao Gio Tro Lai         ,Tran Thai Hoa330,Biet Dau Nguon Coi           ,Don Ho; Ngoc Lan331,Biet Dau Nguon Coi           ,Y Lan332,Biet Dau Tim                 ,Hong Truc333,Biet Dau Tim                 ,Phuong Dung334,Biet Den Bao Gio Dem Tien Don,Truong Vu; Manh Quynh335,Biet Den Bao Gio             ,Phuong Hong Que336,Biet Den Thuo Nao            ,Duong Trieu Vu337,Biet Den Thuo Nao            ,Tu Duc Khai338,Biet Em Con Yeu Anh Khong    ,Hong Truc339,Biet Em Khong Con Nho        ,Vpop340,Biet Khuc Cho Nhau           ,Dan Truong; Trieu Vy341,Biet Khuc Cho Tinh Nhan      ,Thanh Lan342,Biet Khuc                    ,Khanh Ha343,Biet Khuc                    ,Lam Truong344,Biet Khuc                    ,Man345,Biet Kinh Ky                 ,Manh Dinh346,Biet Kinh Ky                 ,Phi Nhung347,Biet Lam Sao De Quen Em      ,Pham Khanh Hung348,Biet Ly                      ,Cam Ly349,Biet Ly                      ,Female350,Biet Ly                      ,Tam Doan351,Biet Ly                      ,Y Lan352,Biet Noi Gi Day              ,Hoa Mi353,Biet Noi Gi Day              ,The Son; Tam Doan354,Biet Phai Lam Sao            ,Tuan Ngoc; Thuy Anh355,Biet Se Mat Nhau             ,Tuan Hung356,Biet Thuo Nao Nguoi          ,Tuan Vu357,Biet Tim Dau                 ,Tuan Hung358,Biet Yeu Khi Nao             ,Cam Ly359,Binh Minh Se Mang Anh Di     ,Diem Lien360,Binh Minh Se Mang Em Di      ,Dam Vinh Hung361,Binh Minh Tinh Yeu           ,Ly Hai; Hoang Chau362,Binh Minh                    ,Dan Truong363,Bo Ben La                    ,Cam Ly364,Bo Ben La                    ,Huynh Phong Dien365,Bo Ben La                    ,Minh Tuyet366,Bo Quen Con Tim              ,Man367,Bo Vo                        ,Luu Bich368,Boi Bac                      ,Tam Doan369,Boi Vi Anh Yeu Em            ,Phan Dinh Tung370,Bon Mat Anh Thuong           ,Minh Ky371,Bon Mau Ao                   ,Vu Tuan372,Bon Mua Thay La              ,Vu Khanh373,Bon Mua                      ,Kha Tu374,Bong Bien                    ,Dan Truong375,Bong Bien                    ,Jenny Hien376,Bong Bong Mua                ,Trinh Nam Son377,Bong Bong Oi                 ,Hong Nhung378,Bong Chieu Ta                ,Quang Dung379,Bong Co May                  ,Truong Vu; Lam Gia Minh380,Bong Co May                  ,Truong Vu381,Bong Dang Thien Than         ,Dan Truong382,Bong Dem                     ,Dalena Doanh Doanh383,Bong Dem                     ,Man384,Bong Dien Dien               ,Ha Vy385,Bong Dien Dien               ,Hoai Nam; Kha Tu386,Bong Dien Dien               ,Huong Lan387,Bong Dien Dien               ,Phi Nhung388,Bong Hong Cai Ao             ,Elvis Phuong389,Bong Hong Viet Nam           ,My Huyen390,Bong Mat                     ,Che Linh391,Bong Mat                     ,Truong Vu392,Bong May Qua Them            ,Thu Minh393,Bong Nguoi Cung Thon         ,My Le394,Bong Nguoi Di                ,Y Lan395,Bong Nho Giao Duong          ,Tuan Vu396,Bot Bien                     ,Nhu Quynh; The Son397,Buc Hoa Dong Que             ,Bonner Trinh398,Buc Tam Thu                  ,Thanh Mai399,Bui Doi                      ,Truong Vu400,Bung Sang                    ,Tran Thai Hoa; The Son; Chi Tai401,Buoc Chan Lam Lo             ,Chau Gia Kiet402,Buoc Chan Lam Lo             ,Chau Gia Kiet403,Buoc Chan Le Loi             ,Dan Truong404,Buoc Chan Phieu Luu          ,Tuan Luc405,Buoc Chan Phong Tran         ,Van Quang Long406,Buoc Chan Phong Tran         ,Van Quang Long407,Buoc Chan Tinh Yeu           ,Tran Tam408,Buoc Chan Viet Nam           ,Hop Ca409,Buoc Phieu Bong              ,Minh Quan410,Buoc Tinh Hong               ,Lili Hue411,Buoc Tinh Hong               ,Nguyen Hung; Ky Duyen412,Buom Trang                   ,Female413,Buom Trang                   ,Giao Linh414,Buom Trang                   ,Quang Ha415,Buom Trang                   ,Vu Khanh416,Buom Xuan                    ,Kim Khanh417,Buon Con Sao Sau             ,Quoc Dai418,Buon Ga Nho                  ,Ngoc Son419,Buon Khong Em                ,Thanh Tuyen420,Buon Ma Chi Em               ,My Huyen421,Buon Mai Quanh Ta            ,Thai Hien422,Buon Oi Chao Mi              ,Bang Kieu423,Buon Oi Chao Mi              ,Female424,Buon Oi Xin Hay Quen         ,Ai Van; Nguyen Hung425,Buon Tan Thu                 ,Anh Tuyet426,Buon Tan Thu                 ,Ngoc Ha427,Buon Trong Dem Mua           ,Ngoc Thuy428,Buon Trong Ky Niem           ,Ha Mi429,Buon Vao Dem                 ,Huong Lan430,Buon Vao Dem                 ,Truong Vu431,Buon Vuong Mau Ao            ,Female432,Buon Vuong Mau Ao            ,Luu Hong433,Buon Vuong Mau Ao            ,Man434,Buon                         ,Anh Thu435,Buon                         ,Y Lan436,Bup Be Khong Tinh Yeu        ,Female437,Bup Be Khong Tinh Yeu        ,Truc Lam; Truc Linh438,Ca Dao Em Va Toi             ,Ngoc Huyen; Che Thanh439,Ca Dao Em Va Toi             ,Quang Linh440,Ca Dao Me                    ,Quang Dung441,Ca Dao Me                    ,Trinh Vinh Trinh442,Ca Khuc Mung Xuan            ,Thanh Truc; Phillip Huy443,Ca Khuc Ngay Mai             ,Che Phuong444,Ca Phe Mot Minh              ,Dan Huy445,Ca Phe Mot Minh              ,M446,Cac Anh Di                   ,Huong Lan; Nguyen Hung447,Cac Anh Di                   ,Quang Dung448,Cac Anh Ve                   ,Nhu Quynh449,Cac Anh Ve                   ,Quan Kim Thuy450,Cac Anh Ve                   ,Quang Dung451,Cafe Buon                    ,Minh Tuyet; Nhat Trung452,Cafe Dang Tro Lai            ,Don Ho453,Cafe Dang Tro Lai            ,Huy Vu454,Cafe Dang                    ,Hoang Nam455,Cafe Dang                    ,Huy Vu456,Cafe Dang                    ,Le Tri457,Cafe Mot Minh                ,Mong Thi458,Cafe Mot Minh                ,Nguyen Hung; Bao Ngoc459,Cai Tram Em Cai              ,Thien Kim460,Cam Bay Tinh Yeu             ,Phan Dinh Tung461,Cam On Ban Toi               ,Pham Khanh Hung462,Cam On Mot Doa Xuan Ngoi     ,My Tam463,Cam On Mua Thu               ,Thu Ha464,Cam On Nguoi Tinh            ,Thanh Ha465,Cam On Tinh Em               ,Vu Khanh466,Cam On                       ,Manh Quynh467,Cam Tay Mua He               ,Thanh Lam468,Cam Xuc Tinh Yeu             ,Thanh Hai469,Can Gac Luu Day              ,Lam Nhat Tien470,Can Nha Di Vang              ,Truong Vu471,Can Nha Mau Tim              ,Ngoc Hue472,Can Nha Mau Tim              ,Truong Vu473,Can Nha Mong Uoc             ,Truong Vu474,Can Nha Ngoai O              ,Man475,Can Nha Ngoai O              ,Truong Vu476,Can Nha Vang Doi Tinh Nhan   ,Tran Nguyen477,Can Nha Xua                  ,Khanh Ly478,Can Thiet                    ,Thanh Ha479,Cang Quen Cang Dau           ,Luu Chi Vy480,Canh Buom Chuyen Ben         ,Manh Quynh481,Canh Buom Chuyen Ben         ,Phuong Dung; Thanh Thuy482,Canh Buom Chuyen Ben         ,Tuan Vu483,Canh Buom Ngay Xuan          ,Ho Le Thu484,Canh Buom Vuon Xuan          ,Thu Minh485,Canh Buom Xa Xua             ,Man486,Canh Chim Lac Loai           ,Cam Ly487,Canh Chim Tren Song          ,Thien Truong; Dia Hai488,Canh Chim Tren Song          ,Thien Truong; Dia Hai489,Canh Chim Troi               ,Son Ca490,Canh Chim Xa Roi             ,Vu Tuan Duc491,Canh Co Va Dong Song         ,Mong Thi492,Canh Co Va Giong Song        ,Tam Doan493,Canh Cong Rau Dang           ,Phi Nhung494,Canh Dong Tuyet              ,Minh Hang495,Canh Hoa Le Loi              ,Luu My Linh496,Canh Hoa Rung                ,Phi Nhung497,Canh Hoa Tan                 ,Dien Thai Toan498,Canh Hoa Tinh Yeu            ,Lucia Kim Chi499,Canh Thiep Dau Xuan          ,Female500,Canh Thiep Dau Xuan          ,Huong Lan501,Canh Thiep Hong              ,Hong Truc502,Cat Bui Tinh Xa              ,Female503,Cat Bui Tinh Xa              ,Thuy Ha Tu504,Cat Bui                      ,Khanh Ly505,Cat Bui                      ,Ngoc Son506,Cau Chuyen Dau Nam           ,Dinh Van507,Cau Chuyen Dau Nam           ,Nhu Quynh508,Cau Chuyen Dau Xuan          ,Hoang Oanh509,Cau Chuyen Gian Hon          ,Sy Dan510,Cau Chuyen Tinh Toi          ,Quang Dung511,Cau Chuyen Trong Tuong       ,Hai Ly; Bruce Doan512,Cau Hat Tinh Que             ,Manh Quynh513,Cau Hat Tinh Que             ,Ngoc Son514,Cau Hat Tinh Que             ,Tuong Nguyen515,Cau Ho Ben Bo Hien Luong     ,Quang Linh516,Cau Kinh Tinh Yeu            ,Sy Dan517,Cau Tre Que Huong            ,Duy Linh518,Cau Vong Khuyet              ,Tuan Hung519,Cay Ba Dau                   ,Cam Ly; Man520,Cay Ba Dau                   ,Cam Ly; Man521,Cay Cau Dua                  ,Cao Thanh522,Cay Cau Dua                  ,Ngoc Son523,Cay Dan Bo Quen              ,Female524,Cay Dan Bo Quen              ,Man525,Cay Dan Bo Quen              ,Vu Khanh526,Cay Dan Sinh Vien            ,Bruce Doan527,Cay Dan Sinh Vien            ,My Tam528,Cay Dan Sinh Vien            ,Thanh Truc529,Cay Dang Bo Moi              ,Hong Truc530,Cay Dang Bo Moi              ,Quang Le531,Cay Dang Tinh Doi            ,Female532,Cay Dang Tinh Doi            ,Tam Doan533,Cha Cha Cha Buon             ,Le Tam534,Cha Yeu                      ,Hoai Vu535,Cha Yeu                      ,Lam Truong536,Cha Yeu                      ,Minh Thuan537,Cha Yeu                      ,Ngoc Huyen538,Chac Anh Co Yeu Em Khong     ,Pham Khanh Hung; May Trang539,Chac Khong Bao Gio           ,Hoang Lan540,Chan Anh Ghe                 ,Diep Thanh Thanh541,Chan Nan                     ,Thanh Ha542,Chan Que                     ,Quang Le543,Chan Que                     ,Quang Linh544,Chan Que                     ,Vu Son545,Chan Tinh                    ,Ha Vy546,Chan Tinh                    ,Huy Vu547,Chan Tinh                    ,The Son548,Chan Tinh                    ,Van Truong549,Chang Dam Lam Quen           ,Ha Vy550,Chang La Ai                  ,Mong Ngoc551,Chang La Ai                  ,Thanh Truc552,Chang Lui                    ,Christiane Le553,Chang Trai De Thuong         ,Thai Phong Vu554,Chanh Long                   ,Manh Quynh555,Chanh Long                   ,Tam Doan556,Chap Tay Lay Nguoi           ,Lam Gia Minh557,Chay Theo Co Be Yeu          ,Luu Chi Vy558,Chen Dang                    ,Dam Vinh Hung559,Chen Dang                    ,Thu Phuong560,Chi Can Anh Con Nho          ,Hong Ngoc561,Chi Can Anh Yeu Em La Du     ,Hoang Chau562,Chi Chung Do Thoi            ,Duy Quang563,Chi Chung Mot Nam Thoi       ,Thuy Hang564,Chi Co Ban Be Thoi           ,Ha Vy565,Chi Co Ban Be Thoi           ,Manh Quynh566,Chi Co Ban Be Thoi           ,Tam Doan; Quoc Dung567,Chi Co Ban Be Thoi           ,The Vu568,Chi Co Ban Be Thoi           ,Truong Vu569,Chi Co Em Yeu Anh            ,Ngoc Thuy570,Chi Co Em Yeu Em Bon Mua     ,Henry Chuc; Bao Han; Jenny Loan571,Chi Co Em                    ,Christian Le572,Chi Co Em                    ,Elvis Phuong573,Chi Co Em                    ,Henry Chuc; Bao Han574,Chi Co Em                    ,Vu Tuan575,Chi Co Minh Anh              ,Kha Tu576,Chi Co Mot Thoi              ,Quang Dung577,Chi Co Mot Tinh Yeu          ,Uyen Trang