3338,Mua Tren Pho Hue             ,Phi Nhung3339,Mua Tren Pho                 ,Cat Tien3340,Mua Trong Mat Em             ,Khanh Ha3341,Mua Trong Mat Em             ,Vu Tuan Duc3342,Mua Tuyet Vong               ,Johnny Dung3343,Mua Tuyet Vong               ,Nguyen Phi Hung3344,Mua Uot Mi Buon              ,Luu Bich3345,Mua Ve Sau                   ,Phi Nhung3346,Mua Ve Thanh Pho             ,Chung Tu Luu3347,Mua Xa                       ,Ngoc Bich3348,Mua Xuan Cua Me              ,Ngoc Ha3349,Mua Xuan Cua Me              ,Truong Vu3350,Mua Xuan Cua Toi             ,Truong Vu3351,Mua Xuan Dang Den            ,Luu Bich3352,Mua Xuan Dau Tien            ,Ngoc Bich3353,Mua Xuan Dau Tien            ,Nhu Quynh; The Son3354,Mua Xuan Do Co Em            ,Che Linh3355,Mua Xuan Khong Con Nua       ,Manh Quynh3356,Mua Xuan La Kho              ,Lam Gia Minh3357,Mua Xuan La Kho              ,Manh Quynh3358,Mua Xuan Nao Chua Ve Hoi Em  ,Tuan Ngoc3359,Mua Xuan Nho Me              ,Cao Thanh3360,Mua Xuan Nong Nan            ,Lam Truong3361,Mua Xuan Qua                 ,Female3362,Mua Xuan Sao Chua Ve Hoi Em  ,Tuan Ngoc3363,Mua Xuan Tinh Yeu            ,Quang Dung3364,Mua Xuan Tren Dinh Binh Yen  ,Thai Hien3365,Mua Xuan Tro Ve              ,Luong Tung Quang; Bao Han3366,Mua Xuan Trong Doi Mat Em    ,Duc Huy3367,Mua Xuan Trong Doi Mat Em    ,Ngoc Lan3368,Mua Xuan Trong Thu Em        ,Truong Vu3369,Mua Xuan                     ,Minh Tuyet3370,Mua                          ,Doan Trang3371,Mua                          ,Duy Linh3372,Mua                          ,My Nhung3373,Muc Anh Trang Vang           ,Nhu Quynh; The Son3374,Muc Tim Mong Toi             ,Hoai Nam3375,Muc Tim Mong Toi             ,Truong Vu3376,Mung Nang Xuan Ve            ,Hop Ca3377,Mung Tuoi Me                 ,Ha Phuong3378,Mung Tuoi Me                 ,Quang Le3379,Mung Tuoi Me                 ,Truong Vu3380,Muoi Ba Tuoi Linh            ,Vu Son3381,Muoi Nam Tai Ngo             ,Manh Quynh3382,Muoi Nam Tinh Cu             ,Dalena3383,Muoi Nam Tinh Cu             ,Lam Hung3384,Muoi Nam Yeu Em              ,Bruce Doan3385,Muoi Ngon Tay Tinh Yeu       ,Nhu Quynh3386,Muoi Sau Trang Tron          ,Truong Vu3387,Muoi Thuong                  ,Man3388,Muon Duoc Gan Anh Hon        ,Minh Tuyet3389,Muon Khoc Hay Khoc Di Em     ,Pham Khanh Hung3390,Muon Mang Khi Em Ra Di       ,1088 Band3391,Muon Mang Khi Em Ra Di       ,1088 Band3392,Muon Mang                    ,Le Toan3393,Muon Mang                    ,Minh Tuyet3394,Muon                         ,Dam Vinh Hung3395,Muon                         ,Tran Thaihoa3396,Muon                         ,Tu Quyen3397,Nac Thang Tinh Yeu           ,Johnny Dung3398,Nam 17 Tuoi                  ,Ha Vy3399,Nam 17 Tuoi                  ,Male3400,Nam 17 Tuoi                  ,Nguyet Thanh3401,Nam 2000                     ,Bao Tuan3402,Nam Cum Nui Que Huong        ,Hong Truc3403,Nam Gam Hoa                  ,My Tam3404,Nam Tu Bay Nam               ,Son Ca3405,Nang Chieu                   ,Female3406,Nang Chieu                   ,Kim Anh3407,Nang Chieu                   ,Thanh Ha3408,Nang Co Con Xuan             ,Khanh Ha3409,Nang Dep Mien Nam            ,Phuong Loan; Ngoc Thuy3410,Nang Ha                      ,Female3411,Nang Paris Nang Sai Gon      ,Thai Hien3412,Nang Saigon Nang Paris       ,Tran Duc3413,Nang Thu                     ,Lam Thuy Van3414,Nang Thuy Tinh               ,Ngoc Bich3415,Nang Tien Cua Linh           ,Hung Cuong; Mai Le Huyen3416,Nang Trung Hoa Xinh Dep      ,Anh Minh3417,Nang Ua Tinh Toi             ,Quang Dung3418,Nang Ve Theo Anh             ,Luong Tung Quang; Bao Han3419,Nang Xanh                    ,Truc Lam; Truc Linh3420,Nang Xuan Cua Toi            ,Hong Hanh3421,Nang Xuan                    ,Ngoc Lan3422,Nang Yeu Hoa Tim             ,Phi Nhung3423,Nang Yeu Hoa Tim             ,Truong Vu3424,Nang                         ,Vu Khanh3425,Nay Co Em                    ,Kenny Thai3426,Nay Nguoi Yeu                ,M3427,Nen Huong Yeu                ,Hong Truc3428,Net Buon Thoi Chien          ,Phi Nhung3429,Net Son Buon                 ,Sisi Thanh Ly3430,Neu Anh Dung Hen             ,Duy Linh; Tam Doan3431,Neu Anh Dung Hen             ,Phi Nhung3432,Neu Anh Ve Ben Em            ,Female3433,Neu Biet Toi Lay Chong       ,Phuong Diem Hanh3434,Neu Biet Truoc               ,Gia Huy3435,Neu Biet Truoc               ,Philip Huy3436,Neu Biet Truoc               ,"Tran Tam, Nini Khanh"3437,Neu Chua La                  ,La S Suong3438,Neu Chung Minh Cach Tro      ,Che Linh; Phi Nhung3439,Neu Chung Minh Cach Tro      ,Ha Vy3440,Neu Chung Minh Cach Tro      ,Khanh Hoang3441,Neu Co Em                    ,Le Tam3442,Neu Co Lo Xa Lia Nhau        ,Tuan Hung3443,Neu Co Yeu Toi               ,Dam Vinh Hung3444,Neu Con Mai Sau              ,Ngoc Anh3445,Neu Dieu Do Xay Ra           ,Diem Lien3446,Neu Dieu Do Xay Ra           ,Phuong Thanh3447,Neu Dieu Do Xay Ra           ,The Son3448,Neu Doi Khong Co Anh         ,Thanh Tuyen3449,Neu Dung Gian Doi            ,Hang Nga3450,Neu Em Thay Co Don           ,Lam Truong3451,Neu Khong Co Em              ,Lam Nhat Tien3452,Neu Lo Chung Minh            ,Truong Vu3453,Neu Mai Nay Xa Nhau          ,Ni Ni Khanh3454,Neu Mai Nay                  ,The Son3455,Neu Mot Mai Anh Biet Kinh Ky ,Son Ca; Duy Quang3456,Neu Mot Ngay                 ,Bruce Doan3457,Neu Mot Ngay                 ,Nguyen Hung; Don Ho3458,Neu Ngay Do                  ,Dam Vinh Hung3459,Neu Phai La Duyen So         ,Bao Han3460,Neu Phoi Pha Ngay Mai        ,Huy Vu; Minh Tuyet3461,Neu Phoi Pha Ngay Mai        ,Minh Vi3462,Neu Ta Con Yeu Nhau          ,Ung Hoang Phuc; Quynh Anh3463,Neu Ta Dung Quen Nhau        ,Hong Truc3464,Neu Vang Anh Noi Long Nguoi Di,Vu Khanh; Kim Anh3465,Neu Vang Anh                 ,Thanh Lan3466,Neu Xuan Nay Vang Anh        ,Minh Tuyet3467,Neu                          ,The Son3468,Nga Ba Tinh                  ,Cam Ly3469,Nga Ba Tinh                  ,Thien Truong Dia Hai3470,Ngai Ngung                   ,Quang Le3471,Ngai Ngung                   ,Quanh Linh3472,Ngai Tieng Gan Xa            ,Truong Vu3473,Ngam Ngui                    ,Man3474,Ngan Cach                    ,Hai Ly3475,Ngan Cach                    ,Hoang Nam3476,Ngan Doi Anh Van Yeu Em      ,Phan Dinh Tung3477,Ngan Doi Cho Mong            ,Thanh Ha3478,Ngan Nam Kho Phai            ,Hoang Chau3479,Ngan Nam Kho Phai            ,Minh Tuyet3480,Ngan Nam Mai Yeu             ,Luu Bich3481,Ngan Nam May Bay             ,Khanh Ha3482,Ngan Nam Phoi Pha            ,Quang Vinh; Uyen Nhi3483,Ngan Nam Tuong Phung         ,Dang Khoi3484,Ngan Nam Van Doi             ,Female3485,Ngan Nam Van Khong Quen      ,Khanh Ha3486,Ngan Thu Ao Tim              ,Y Lan3487,Ngan Thu Vinh Biet           ,Thanh Tuyen3488,Ngang Trai                   ,Truong Vu3489,Ngap Ngung                   ,Thanh Huyen3490,Ngau Hung Ly Chim Quyen      ,Huong Lan3491,Ngau Hung Ly Qua Cau         ,Vu Tuan3492,Ngay Ay Con Anh              ,Lam Thuy Van3493,Ngay Ay Minh Yeu Nhau        ,Duet3494,Ngay Ben Nhau                ,Lynda Trang Dai3495,Ngay Buon                    ,Ngoc Dai3496,Ngay Buon                    ,Truong Vu3497,Ngay Con Em Ben Toi          ,Truong Vu3498,Ngay Da Dom Bong             ,Man3499,Ngay Da Dom Bong             ,Tam Doan3500,Ngay Dai Tren Que Huong      ,Le Uyen3501,Ngay Di Xa Mai               ,Bang Kieu3502,Ngay Do Con Anh              ,Lam Thuy Van3503,Ngay Do Dau Buon             ,Huy Vu3504,Ngay Do Toi Yeu Em           ,Dam Vinh Hung3505,Ngay Do Xa Roi               ,Phi Nhung3506,Ngay Do                      ,Man3507,Ngay Em 20 Tuoi              ,Hong Truc3508,Ngay Em Di                   ,Dam Vinh Hung3509,Ngay Em Di                   ,Hong Truc3510,Ngay Hom Qua La The          ,Quang Dung3511,Ngay Hom Qua                 ,Cat Tien3512,Ngay Hom Qua                 ,Techno3513,Ngay Khong Ten               ,Dam Vinh Hung3514,Ngay Khong Ten               ,Quang Dung3515,Ngay Mai Anh Di              ,Duy Manh; Hien Thuc3516,Ngay Mai Anh Di              ,Duy Manh3517,Ngay Mai Mua Thoi Roi        ,Minh Tuyet3518,Ngay Mai Troi Lai Sang       ,Huy Vu3519,Ngay Mai Xa Nhau             ,Female3520,Ngay Mua Thoi Roi            ,Cam Ly; Van Quang Long3521,Ngay Mua Thoi Roi            ,Hoai An3522,Ngay Mua Trong Doi           ,Sy Dan3523,Ngay Mua Tuyet               ,Nini; Uyen My; Ha Vy3524,Ngay Nao Em Di Lay Chong     ,Diep Thanh Thanh3525,Ngay Nay Khong Con Be        ,Trinh Vinh Trinh3526,Ngay Sau Se Ra Sao           ,Truong Vu3527,Ngay Ta Ben Nhau             ,Thai Chau3528,Ngay Ta Ben Nhau             ,Thanh Ha3529,Ngay Ta Xa Nhau              ,Minh Tuyet; Cam Ly3530,Ngay Tan Hon                 ,Christiane Le3531,Ngay Thang Cua Tinh Yeu      ,Lam Thuy Van3532,Ngay Tho                     ,Diem Lien3533,Ngay Tho                     ,Kha Tu3534,Ngay Tro Ve                  ,Hoang Oanh3535,Ngay Tro Ve                  ,Man3536,Ngay Tro Ve                  ,Truong Vu3537,Ngay Ve                      ,Son Ca3538,Ngay Vui Qua Mau             ,Ky Vuong3539,Ngay Vui Qua Mau             ,The Son3540,Ngay Xua Anh Hoi             ,Minh Tuyet3541,Ngay Xua Anh Noi             ,Phi Nhung3542,Ngay Xua Anh Noi             ,Yen Vy3543,Ngay Xua Con Be              ,Tam Ca Ao Trang3544,Ngay Xua Hai Dua             ,Van Quang Long; Cam Ly3545,Ngay Xua Hoang Thi           ,Male3546,Ngay Xua Hoang Thi           ,Thanh Lan3547,Ngay Xua Len 5 Len 3         ,Quang Linh; My Le3548,Ngay Xuan Tai Ngo            ,Manh Quynh; Ha Phuong3549,Ngay Xuan Tham Nhau          ,Huong Lan; Duy Khanh3550,Nghe Dieu Ly Que Houng       ,Huong Lan3551,Nghe Nhung Tan Phai          ,Sy Phu3552,Nghen Ngao                   ,Hoa Mi3553,Ngheo Ma Co Tinh             ,Truong Vu3554,Ngheo                        ,Truong Vu3555,Nghin Trung Xa Cach          ,Diem Lien3556,Nghin Trung Xa Cach          ,Khanh Ha3557,Nghin Trung Xa Cach          ,Man3558,Ngo Dau Tinh Da Quen Minh    ,My Tam3559,Ngo Hon Qua Dem              ,Truong Vu3560,Ngo Ngang                    ,Bao Han3561,Ngo Ngang                    ,Tuan Ngoc3562,Ngo Nhu Giac Mo              ,Khanh Ngoc3563,Ngo Nhu Tim Thay Em          ,Duet3564,Ngo Vang Tinh Yeu            ,Manh Quynh; Que Trang3565,Ngo Y                        ,Tuan Vu3566,Ngoai O Buon                 ,Doan Thy; Bruce Doan3567,Ngoai O Buon                 ,Truong Vu3568,Ngoai O Den Vang             ,Che Linh3569,Ngoeo Tay Nhau The           ,Tam Doan3570,Ngoi Hat Ca Bong Benh        ,Thanh Lam3571,Ngoi Nha Hoa Hong            ,Bao Thy; Quang Vinh3572,Ngoi Nha Hoa Hong            ,Bao Thy3573,Ngoi Nha Trong Anh Binh Minh ,Ngoc Anh3574,Ngoi Om Bong Em              ,Nguyen Thang3575,Ngoi Sao Pha Le              ,Thuy Tien3576,Ngoi Ton Tho                 ,Male3577,Ngoi Xuong Day               ,Le Uyen Phuong3578,Ngu Di Con                   ,Hong Nhung3579,Ngu Di Em                    ,Che Linh3580,Ngua Phi Duong Xa            ,Cao Minh3581,Ngua Phi Duong Xa            ,Son Ca3582,Nguoi Ay Va Toi Em Chon Ai   ,Luu Chi Vy3583,Nguoi Ay Va Toi Em Phai Chon ,Luu Chi Vy3584,Nguoi Cho Em Biet Co Don     ,Ho Le Thu3585,Nguoi Co Nho Ta Chang        ,Bach Yen3586,Nguoi Con Gai Hai Sim        ,Truong Vu3587,Nguoi Con Gai                ,Luu Bich3588,Nguoi Cung Canh Ngo          ,Bao Han3589,Nguoi Cung Canh Ngo          ,Ha Vy3590,Nguoi Da Nhu Mo              ,Ha Vy3591,Nguoi Da Nhu Mo              ,Ky Vuong Dai Trang3592,Nguoi Da Quen                ,Tam Doan3593,Nguoi Da Thay Long           ,Phi Nhung3594,Nguoi Da Thay Long           ,Truong Vu3595,Nguoi Da Xa Mai              ,Dan Truong3596,Nguoi Dan Ba 2000 Nam Truoc  ,Huy Vu3597,Nguoi Dan Ong Chan That      ,Tran Tam3598,Nguoi Dan Ong Khong Can Dan Ba,Quach Thanh Danh3599,Nguoi Dan Ong Khong Tinh Yeu ,Dam Vinh Hung3600,Nguoi Dan Ong Tham Lam       ,Hoang Chau3601,Nguoi Dau Gio                ,Bruce Doan3602,Nguoi Dau Gio                ,Truong Vu3603,Nguoi Den Sau                ,Cam Ly3604,Nguoi Dep Binh Duong         ,Duy Linh3605,Nguoi Dep Binh Duong         ,Hoang Lan3606,Nguoi Dep Trong Tranh        ,The Son Ai Van3607,Nguoi Dep Xinh Xinh          ,Gia Huy3608,Nguoi Di Nhu Nang Phai       ,Quang Dung3609,Nguoi Di Qua Doi Toi Nua Hon Thuong Dau,Y Phuong; Minh Thong3610,Nguoi Di Qua Doi Toi         ,Julie3611,Nguoi Di Qua Doi Toi         ,Yen Phuong3612,Nguoi Dien Yeu               ,Minh Hang3613,Nguoi Em Gai Mien Nam        ,Phi Nhung3614,Nguoi Em Sau Mong            ,Nha Thanh3615,Nguoi Em Xom Dao             ,Man3616,Nguoi Em Xom Dao             ,Tam Doan3617,Nguoi Em Xom Dao             ,Truong Vu3618,Nguoi Giau Cung Kho          ,Manh Quynh3619,Nguoi Giau Cung Khoc         ,Kha Tu3620,Nguoi Giau Tuong Tu          ,Manh Quynh3621,Nguoi Giu Dan Co             ,Tuan Vu3622,Nguoi Hung Va Giai Nhan      ,Hung Cuong3623,Nguoi La Niem Dau            ,Lam Hung3624,Nguoi Linh Gia Xa Que Huong  ,Truong Vu3625,Nguoi Lu Hanh Trong Mua      ,Y Lan3626,Nguoi Mang Tam Su            ,Quang Le3627,Nguoi Mang Tam Su            ,Tam Doan3628,Nguoi Ngoai Pho              ,Nhu Quynh3629,Nguoi Ngoai Pho              ,Truong Vu3630,Nguoi Nho Khong Nguoi        ,Cam Ly3631,Nguoi Nho Khong Nguoi        ,Van Quang Long3632,Nguoi O Lai Charlie          ,Lam Thuy Van; Lam Nhat Tien3633,Nguoi Qua Bong Toi           ,Diem Lien3634,Nguoi Quen Ke Nho            ,Do Thanh3635,Nguoi Ra Di Vi Dau           ,Pham Khanh Hung3636,Nguoi Ra Di                  ,Nguyen Thang3637,Nguoi Ta Noi Em Vui Choi Qua Duong,Luu Chi Vy3638,Nguoi Tho San Va Dan Chim Nho,Khanh Ly3639,Nguoi Thu 3                  ,Vinh Thuyen Kim3640,Nguoi Tinh Dep Xinh Xinh     ,Gia Huy3641,Nguoi Tinh Doi Gian          ,Dam Vinh Hung3642,Nguoi Tinh Ichiban           ,The Son3643,Nguoi Tinh Khong Chan Dung   ,Khanh Ha3644,Nguoi Tinh Khong Den         ,My Linh3645,Nguoi Tinh La Lan            ,The Vu3646,Nguoi Tinh Mua Dong          ,Nhu Quynh3647,Nguoi Tinh Mua Thu           ,Kieu Nga3648,Nguoi Tinh Oi Mo Gi          ,Dam Vinh Hung; My Tam3649,Nguoi Tinh Toi Yeu           ,Thanh Thuy3650,Nguoi Tinh Tram Nam          ,Lam Nhat Tien; Lam Nhat Truong3651,Nguoi Tinh Tram Nam          ,Man3652,Nguoi Tinh Tram Nam          ,Thuy Tien3653,Nguoi Tinh Tram Nam          ,Tuan Hung3654,Nguoi Tinh Trong Mong        ,Trinh Nam Son3655,Nguoi Tinh Va Que Huong      ,My Huyen3656,Nguoi Tinh Va Que Huong      ,Tuan Vu3657,Nguoi Tinh Van Khoa          ,Nguyen Khang3658,Nguoi Tinh Xa                ,Female3659,Nguoi Tinh                   ,Quan Kim Thuy3660,Nguoi Trong Mong             ,Mong Ngoc3661,Nguoi Ve Cuoi Pho            ,Dan Truong3662,Nguoi Ve Cuoi Pho            ,Minh Tuyet3663,Nguoi Ve Don Vi Moi          ,Lam Gia Minh3664,Nguoi Ve Don Vi Moi          ,Truong Vu3665,Nguoi Ve Thanh Pho           ,Truong Vu3666,Nguoi Ve Tu Long Dat         ,Don Ho3667,Nguoi Ve Tu Long Dat         ,Hong Ngoc3668,Nguoi Ve Tu Long Dat         ,Phuong Thanh3669,Nguoi Ve Tu Phuong Xa        ,Quang Dung3670,Nguoi Viet Nhac Buon         ,Elvis Phuong3671,Nguoi Vo Hinh                ,Minh Hang3672,Nguoi Xoa Vet Tinh Thua      ,Man3673,Nguoi Yeu Co Don             ,Bruce Doan3674,Nguoi Yeu Co Don             ,Son Tuyen3675,Nguoi Yeu Co Don             ,Truong Vu3676,Nguoi Yeu Cua Linh           ,Hong Truc3677,Nguoi Yeu Cua Linh           ,Ngoc Minh; Doanh Doanh3678,Nguoi Yeu Dau Oi             ,My Tam3679,Nguoi Yeu Gia Tu             ,Don Ho3680,Nguoi Yeu Hoi                ,Danny Tien Dung3681,Nguoi Yeu Ly Tuong           ,Mai Le Huyen3682,Nguoi Yeu Neu Ra Di          ,Lam Nhat Tien3683,Nguoi Yeu Toi Dau            ,Cao Thanh3684,Nguoi Yeu Tuong Lai          ,Ha Vy3685,Nguu Lang Chuc Nu            ,Song Ca3686,Nguyen Cau                   ,Thanh Thao3687,Nguyet Cam                   ,Khanh Ha3688,Nha Em                       ,Dam Vinh Hung3689,Nha Trang Ngay Ve            ,Le Toan3690,Nha Trang Ngay Ve            ,Thien Kim3691,Nha Trang                    ,Son Ca3692,Nhac Tinh Buong Loi          ,Tien Dung3693,Nhan Co Cho Em               ,Cao Thanh3694,Nhan Co Cho Em               ,Truong Vu3695,Nhanh Cay Trung Ca           ,Kha Tu3696,Nhanh Cay Trung Ca           ,Le Toan3697,Nhat Ky Cho Ai               ,Van Quang Long3698,Nhat Ky Doi Toi              ,Bruce Doan3699,Nhat Ky Doi Toi              ,Thanh Hang3700,Nhat Ky Doi Toi              ,Truong Vu3701,Nhat Ky Hai Dua Minh         ,Female3702,Nhat Ky Mua Dong             ,Lam Thai Uyen3703,Nhat Nang                    ,Ha Vy3704,Nhat Nhoa                    ,Tran Thai Hoa3705,Nhe Anh                      ,My Tam3706,Nhin Nhau Lan Cuoi           ,Lam Minh3707,Nhin Nhung Mua Thu Di Nang Thuy Tinh,Khanh Ly Le Thu3708,Nhin Nhung Mua Thu Di        ,Khanh Ly3709,Nhip Cau Tri Am              ,Manh Quynh3710,Nhip Dap Con Tim             ,Truc Linh; Tommy Ngo3711,Nhip Dap Dai Kho             ,My Tam3712,Nhip Dieu Cua Tinh Yeu       ,Gia Huy3713,Nho Anh Chieu Mua            ,Ha Vy3714,Nho Anh                      ,Thuy Tien3715,Nho Cha                      ,Ngoc Son3716,Nho Dung Khoc                ,Man3717,Nho Em Ly Bong Mai           ,Ha Phuong3718,Nho Em Trong Chieu           ,Nguyen Thang3719,Nho Em                       ,Ngoc Son3720,Nho Hue                      ,Hoai Nam3721,Nho Ky Niem Chung Ta         ,"Ly Hai, Thanh Thao"3722,Nho Mai Nhau Thoi            ,Huy Vu; Diem Lien3723,Nho Me                       ,Le Tam; Gia Huy3724,Nho Minh Anh Thoi            ,Mai Le Huyen3725,Nho Mot Chieu Xuan           ,Tran Thai Hoa3726,Nho Mua Sai Gon              ,Quang Dung3727,Nho Mua Thu Ha Noi           ,Hong Nhung3728,Nho Mua Thu Ha Noi           ,Man3729,Nho Mua Thu Ha Noi           ,Trinh Vinh Trinh3730,Nho Mua Xua                  ,Quang Dung3731,Nho Nguoi Dung               ,Diep Thanh Thanh3732,Nho Nguoi Tinh Phu           ,Manh Quynh3733,Nho Nguoi Yeu                ,Nhu Quynh; Truong Vu3734,Nho Nguoi Yeu                ,Truong Vu3735,Nho Nguoi                    ,Diem Lien3736,Nho Nguoi                    ,Quang Dung3737,Nho Nhau Hoai                ,Bruce Doan3738,Nho Nhau Lam Gi              ,Nini3739,Nho Nhau Lam Gi              ,The Son3740,Nho Nhau Trong Doi           ,Thanh Thanh3741,Nho Nhau                     ,Ngoc Ha3742,Nho Phut Ay                  ,Trinh Nam Son; To Chan Phong3743,Nho Sai Gon                  ,Hoai Nam3744,Nho Saigon                   ,Lam Truong3745,Nho Saigon                   ,Nguyen Khang3746,Nho Ta Thi Ve                ,Ngoc Lan3747,Nho Tan Phi                  ,Truong Vu3748,Nho Thanh Do                 ,Thai Chau3749,Nho Ve Em                    ,Luong Gia Huy3750,Nho Ve Em                    ,Nguyen Khang3751,Nho Ve Em                    ,Truong Vu3752,Nho Ve Hoi Lim               ,Ai Van3753,Nho Ve Mot Mua Xuan          ,Luu Bich3754,Nho Ve Mot Mua Xuan          ,Truong Vu3755,Nho                          ,Dam Vinh Hung3756,Nho                          ,Luu Bich3757,Nho                          ,My Tam3758,Nho                          ,Trinh Nam Son3759,Nhu Anh Can Em               ,Lam Nhat Tien3760,Nhu Canh Vac Bay             ,Anh Thu3761,Nhu Canh Vac Bay             ,Don Ho3762,Nhu Canh Vac Bay             ,Gia Huy; Nhu Quynh3763,Nhu Canh Vac Bay             ,Le Uyen3764,Nhu Chiec Que Diem           ,Quang Dung3765,Nhu Chiec Que Diem           ,Y Lan3766,Nhu Con Gio Vo Tinh          ,The Son3767,Nhu Con Mua Di Mai           ,Luu Bich3768,Nhu Da Dau Yeu               ,Anh Tu3769,Nhu Da Dau Yeu               ,Elvis Phuong3770,Nhu Da Dau Yeu               ,Thai Hien3771,Nhu Da Dau Yeu               ,Vu Khanh3772,Nhu Giac Chiem Bao           ,Gia Huy3773,Nhu Giac Chiem Bao           ,Thao My3774,Nhu Giot Sau Roi             ,Christiane Le3775,Nhu Giot Sau Roi             ,Manh Quynh3776,Nhu Khuc Tinh Ca             ,Dan Truong3777,Nhu La Tinh Yeu              ,Nguyen Hung; Loan Chau3778,Nhu May Nhu Mua              ,Vu Khanh; Thanh Ha3779,Nhu May                      ,Chau Gia Kiet3780,Nhu Mot Giac Mo              ,Tu Quyen3781,Nhu Mot Khuc Nhac Buon       ,Don Ho3782,Nhu Mot Loi Chia Tay         ,Quang Minh3783,Nhu Mot Loi Chia Tay         ,Trinh Vinh Trinh3784,Nhu The Tim Chim             ,Truong Vu3785,Nhu Vac Bay                  ,Don Ho3786,Nhu Vat Trang                ,Nhu Quynh; Gia Huy3787,Nhung Buoc Chan Am Tham      ,Bao Han; Ngoc Thuy; Phi Phi3788,Nhung Buoc Chan Am Tham      ,Manh Quynh3789,Nhung Canh Hoa Rung          ,Lucia Kim Chi3790,Nhung Canh Hoa Tinh          ,Tu Ca Ngau Nhien3791,Nhung Chieu Khong Co Em      ,The Son3792,Nhung Chieu La Do            ,Khanh Ly3793,Nhung Chuyen Xe Trong Cuoc Doi,Truong Vu3794,Nhung Con Duong Tinh Su      ,Truong Vu3795,Nhung Con Duong Trang        ,Hoang Oanh3796,Nhung Dem Cho Sang Biet Kinh Ky,Phillip Huy; Tran Thanh Toan3797,Nhung Dem Troi Sang          ,Lam Nhat Tien3798,Nhung Doi Hoa Sim            ,Hoai Nam3799,Nhung Doi Hoa Sim            ,Phuong Dung3800,Nhung Doi Hoa Sim            ,Tuan Vu3801,Nhung Dom Mat Hoa Chau       ,Phi Nhung3802,Nhung Dom Mat Hoa Chau       ,Truong Vu3803,Nhung Don Luu Niem           ,Manh Quynh3804,Nhung Gi Cho Em Cho          ,Anh Khoa3805,Nhung Giai Dieu Khong Quen   ,Nha Thanh3806,Nhung Gian Doi Chi Lam Long Don Dau,Luu Chi Vy3807,Nhung Giot Mua Sau           ,Yen Phuong3808,Nhung Kiep Hoa Xuan          ,Ngoc Lan3809,Nhung Loi Doi Gian           ,Hoang Nam3810,Nhung Loi Doi Gian           ,Lam Truong3811,Nhung Loi Doi Gian           ,Phuong Hung3812,Nhung Manh Vo Tinh Yeu       ,Sy Dan3813,Nhung Mua Dau Yeu            ,Dan Truong3814,Nhung Mua Dau Yeu            ,Man3815,Nhung Nam Mo Hoang Tro Ve Cat Bui,Lam Nhat Tien; Lam Thuy Van3816,Nhung Neo Duong Viet Nam     ,The Son; Nhu Quynh; Manh Dinh; My Huyen3817,Nhung Ngay Mua Gio           ,Y Lan3818,Nhung Ngay Nghi Phep         ,Hung Cuong3819,Nhung Ngay Thang Khong Ten   ,Thien Kim3820,Nhung Ngay Thang             ,Ha Vy3821,Nhung Ngay Tho Mong Buon Trong Ky Niem,Thanh Thuy3822,Nhung Ngay Tho Mong          ,Thanh Ha3823,Nhung Ngay Xua Than Ai       ,Female3824,Nhung Ngay Xua Than Ai       ,Quang Le3825,Nhung Nguoi Khong Chet       ,Lam Thuy Van3826,Nhung Nu Tinh Xanh           ,Female3827,Nhung Tam Hon Co Don         ,Man3828,Nhung Tam Hon Hoang Lanh     ,Vu Khanh3829,Nhung Vong Tay Xuo           ,The Son3830,Niem Co Don Cuoi Cung        ,Sy Dan; Vu Tuan Duc3831,Niem Dau Chon Dau            ,Don Ho3832,Niem Dau Chon Dau            ,Female3833,Niem Dau Cua Cat             ,Luu Bich3834,Niem Khuc Cuoi               ,Dalena3835,Niem Khuc Cuoi               ,Dam Vinh Hung3836,Niem Khuc Cuoi               ,Sy Phu3837,Niem Khuc Cuoi               ,Tuan Ngoc3838,Niem Khuc                    ,Sy Dan3839,Niem Thuong Nho              ,Hoang Nam3840,Niem Thuong Nho              ,Le Toan3841,Niem Tin Tinh Yeu            ,Le Dung3842,Niem Vui Co Don              ,Ai Van; Elvis Phuong3843,Niem Vui Hon Nhien           ,Bao Han3844,Niem Vui Khong Tron Ven      ,Nhu Quynh3845,Ninh Kieu Em Gai Can Tho     ,Huong Lan3846,Niu Keo La Don Dau           ,Thanh Thao3847,Niu Tay Nghin Trung          ,Hong Hanh3848,No Ai Do Ca The Gioi         ,Pham Quynh Anh3849,No Va Toi                    ,Huong Lan3850,No Va Toi                    ,Nguyen Hung; The Son3851,No Va Toi                    ,Truong Vu3852,No Yeu                       ,Phan Dinh Tung3853,No                           ,Che Linh3854,No                           ,Man3855,Noi Ay Binh Yen              ,Lam Nhat Tien3856,Noi Ay Binh Yen              ,Lam Truong3857,Noi Buon Chau Pha            ,Kha Tu3858,Noi Buon Chau Pha            ,Nhu Quynh3859,Noi Buon Chim Sao            ,Cam Ly3860,Noi Buon Chim Sao            ,Phi Nhung3861,Noi Buon Chua Tron           ,Truong Vu3862,Noi Buon Con Gai             ,Thanh Thanh3863,Noi Buon Con Gai             ,Tu Quyen3864,Noi Buon Cua Me              ,Cam Ly3865,Noi Buon Diu Em              ,Lam Truong3866,Noi Buon Gac Tro             ,Dam Vinh Hung3867,Noi Buon Gac Tro             ,Phuong Dung3868,Noi Buon Hoa Phuong          ,Tam Doan3869,Noi Buon Hoa Phuong          ,Thanh Tuyen3870,Noi Buon Hoa Phuong          ,Tuan Vu3871,Noi Buon Rieng Em            ,Ngo Minh Trang3872,Noi Buon Sa Mac              ,Tuan Vu3873,Noi Buon Vo Vong             ,Lam Thai Uyen3874,Noi Buon                     ,Diem Lien3875,Noi Buon                     ,Khanh Ha3876,Noi Cuoi Noi Co Don          ,Gia Huy3877,Noi Dau Diu Dang             ,Thuy Duong3878,Noi Dau Hoang Vang           ,Ly Hai3879,Noi Dau Muon Mang            ,Tuan Ngoc3880,Noi Dau Ngay Qua             ,Cam Ly3881,Noi Dau Ngay Qua             ,Diem Lien3882,Noi Dau Ngot Ngao            ,Dam Vinh Hung3883,Noi Dau Ngot Ngao            ,Lam Thuy Van3884,Noi Dau Ngot Ngao            ,Nguyen Khang3885,Noi Dau Niem Nho             ,Ngoc Huong3886,Noi Dau Vo Thuong            ,Dam Vinh Hung3887,Noi Day Binh Yen             ,Lam Nhat Tien3888,Noi Doi                      ,Tam Doan3889,Noi Lai Tinh Xua             ,Duet3890,Noi Lai Tinh Xua             ,Tuan Vu3891,Noi Long Nguoi Di            ,Thuy Duong3892,Noi Long Nguoi Di            ,Tuan Ngoc3893,Noi Long                     ,Man3894,Noi Long                     ,Thanh Ha3895,Noi Mua Thu Bat Dau          ,Bang Kieu3896,Noi Nho Diu Em               ,Gia Huy Nhat Quan3897,Noi Nho Diu Em               ,Johnny Dung3898,Noi Nho Diu Em               ,Lam Truong3899,Noi Nho Khon Nguoi           ,Diem Lien3900,Noi Nho Noi Con Tim Mo Coi   ,Hoang Chau; Khanh Dang3901,Noi Nho Rieng Em             ,Cam Ly