1707,Em Di Chua Huong             ,Hong Van1708,Em Di Chua Huong             ,Y Lan1709,Em Di Mua Cuoi               ,Tuan Vu1710,Em Di Noi Ay                 ,Jimmi Jc Nguyen1711,Em Di Roi                    ,Le Tri1712,Em Di Tren Co Non            ,Huong Lan1713,Em Di Tren Co Non            ,Kha Tu1714,Em Di Tren Co Non            ,Phi Nhung1715,Em Di Tren Co Non            ,Phuong Hong Que1716,Em Di Xem Hoi Trang Ram      ,Anh Dung; Quynh Huong1717,Em Di Xem Hoi Trang Ram      ,Nhu Quynh1718,Em Di                        ,Don Ho1719,Em Di                        ,Man1720,Em Di                        ,Thai Chau1721,Em Gang Cho                  ,Tran Thai Hoa1722,Em Hau Phuong Anh Tien Tuyen ,Manh Dinh; Y Phung1723,Em Hau Phuong Anh Tien Tuyen ,Truong Vu; Nhu Quynh1724,Em Hau Phuong Anh Tien Tuyen ,Tuan Vu; Huong Lan1725,Em Hau Phuong Anh Tien Tuyen ,Tuan Vu1726,Em Hay Ngu Di                ,My Linh1727,Em Hay Ngu Di                ,My Tam1728,Em Hay Ngu Di                ,Thanh Ha1729,Em Hay Ngu Di                ,Thanh Lam1730,Em Hay Ve Di                 ,Che Thanh1731,Em Hay Ve Di                 ,Truong Vu1732,Em Hey                       ,Man1733,Em Hien Nhu Ma Soeur         ,Tran Thai Hoa1734,Em Khoc Di Em                ,Man1735,Em Khong Buon Nhung Em Se Khoc Vi Em,Hoang Chau1736,Em La Anh Sao Bang           ,Le Dung1737,Em La Bien Rong              ,Ninh Cat Loan Chau1738,Em La Doa Hoa Hong           ,Thanh Thuy1739,Em La Mua Xuan               ,Lam Truong1740,Em La Mua Xuan               ,Thuy Tien1741,Em La Tat Ca                 ,Tuan Vu1742,Em La Vi Sao Trong Mat Anh   ,Nhat Thang1743,Em Mai Yeu Anh               ,Thanh Trucentertaiment1744,Em Moi Biet Yeu Lan Dau      ,Dalena1745,Em Ngu Trong Mot Mua Dong    ,Vu Khanh; Y Lan1746,Em Ngu Trong Mot Mua Dong    ,Y Lan1747,Em Nho Anh Nhieu Hon         ,Cam Ly1748,Em Nhu Lan May               ,Lynda Trang Dai; Tommy Ngo1749,Em Nhu Tia Nang Mat Troi     ,Thanh Vy1750,Em Oi Dung Doi Thay          ,Van Quang Long1751,Em Oi Ha Noi Pho             ,Cam Van1752,Em Oi Ha Noi Pho             ,Khanh Ly1753,Em Oi La Thu Mua             ,Tu Quyen; Johnny Dung1754,Em Quen Mua Dong             ,Lam Truong1755,Em Quen Mua Dong             ,Minh Tuyet1756,Em Rang Cho                  ,Tran Thai Hoa1757,Em Sap Ve Chua               ,Truong Vu1758,Em Se Den                    ,Thuy Tien1759,Em Se La Nguoi Ra Di         ,Cam Ly1760,Em Toi                       ,Dinh Vu1761,Em Toi                       ,Quang Linh1762,Em Tuyet Voi                 ,Quang Dung1763,Em Va Co Ay Anh Phai Lam Sao ,Luu Chi Vy1764,Em Van Biet                  ,Minh Tuyet1765,Em Van Can Anh               ,Truc Loan1766,Em Van Cho Anh               ,Cat Tien1767,Em Van Cho Anh               ,La Suong Suong1768,Em Van Lam Tin Anh           ,Cam Ly1769,Em Van Mai La Niem Dau       ,Quang Dung1770,Em Van Mo                    ,Thanh Truc1771,Em Ve Keo Mua                ,Khanh Hoang1772,Em Ve Keo Mua                ,Phi Nhung1773,Em Ve Keo Mua                ,Thanh Thu1774,Em Ve Keo Troi Mua           ,Cam Ly1775,Em Ve Miet Thu               ,Kha Tu1776,Em Ve Nao Co Hay             ,Ngoc Lan1777,Em Ve Qua Ben Bac            ,Khanh Hoang1778,Em Ve Qua Ben Bac            ,Phi Nhung1779,Em Ve Tinh Khoi              ,Bang Kieu1780,Em Ve Tinh Khoi              ,Dan Huy; Tuong Vi1781,Em Ve Tinh Khoi              ,Johnny Dung; Minh Tuyet1782,Em Ve Tinh Khoi              ,Ngoc Hanh; Tony Tuan1783,Em Ve Tinh Khoi              ,Nhat Hao1784,Em Ve Tinh Khoi              ,Phuong Thanh; Bang Kieu1785,Em Ve Tinh Khoi              ,Tran Thai Ha1786,Em Ve Voi Nguoi              ,Ngoc Son1787,Em Ve Voi Nguoi              ,Quang Le1788,Em Ve                        ,Hong Ngoc1789,Em Ve                        ,Lam Thuy Van1790,Em Xinh Nhat Dem Nay         ,Trinh Nam Son1791,Em Yeu I Love You            ,Phan Dinh Tung1792,Em                           ,Ngoc Ho1793,Email Tinh Yeu               ,Dan Truong1794,Ga Chieu                     ,Phuong Mai1795,Gac Nho Dem Xuan             ,Huong Lan1796,Gai Nha Ngheo                ,Ha Vy1797,Gai Nha Ngheo                ,Mong Thi1798,Gai Nha Ngheo                ,My Huyen1799,Gai Xuan                     ,Ha Phuong1800,Gai Xuan                     ,Hai Ly1801,Gai Xuan                     ,Huong Lan1802,Gai Xuan                     ,Man1803,Gan Nhu Niem Tuyet Vong      ,Vu Khanh1804,Ganh Lua                     ,Nguyen Hung; Nhu Quynh1805,Gap Lai Co Nhan              ,Truong Vu1806,Gap Lai Nguoi Xua            ,Manh Quynh; Que Trang1807,Gap Nhau Lam Chi             ,Truong Vu1808,Gap Nhau Lam Ngo             ,Son Tuyen; Tuan Vu1809,Gap Nhau Trong Mua           ,Truong Vu1810,Ghen                         ,Man1811,Ghen                         ,Ngoc Bao1812,Ghen                         ,Tuan Ngoc1813,Ghen                         ,Vu Khanh1814,Ghet Anh Ghe                 ,Hung Cuong; Mai Le Huyen1815,Gia Biet Sai Gon             ,Thanh Tuyen1816,Gia Biet Sai Gon             ,Truong Vu1817,Gia Biet Tinh Em             ,Vu Khanh1818,Gia Biet Truong Xua          ,Hong Truc1819,Gia Dieu Tinh Yeu            ,Quang Dung1820,Gia Doi                      ,Phuong Nghi1821,Gia Tu Co Do                 ,Ngoc Ha1822,Gia Tu Dem Mua               ,Female1823,Gia Tu Dem Mua               ,Khanh Hoang1824,Gia Tu Dem Mua               ,Le Tam1825,Gia Tu Dem Mua               ,Le Toan1826,Gia Tu Di Vang               ,Hoai Vu1827,Gia Tu Di Vang               ,Truc Lan1828,Gia Tu Em                    ,Ly Hai; Thanh Thao1829,Gia Tu Tinh Yeu              ,Female1830,Gia Tu Vu Khi                ,Che Linh1831,Gia Tu Vu Khi                ,Truong Vu1832,Gia Tu                       ,Nguyen Son1833,Gia Tu                       ,Que Trang1834,Gia Tu                       ,Quoc Dai1835,Giac Mo Ban Dau              ,Tommy Ngo1836,Giac Mo Buon                 ,Quang Dung1837,Giac Mo Canh Co              ,Phi Nhung; Nhu Quynh1838,Giac Mo Co Em                ,Ly Hai1839,Giac Mo Hoi Huong            ,Le Thu1840,Giac Mo Hoi Huong            ,Tran Duc1841,Giac Mo Khong Den Hai Lan    ,The Son1842,Giac Mo Mong Say             ,Thanh Thuy1843,Giac Mo Mua Dong             ,Dan Truong1844,Giac Mo Mua Dong             ,Huy Vu1845,Giac Mo Mua Dong             ,Loan Chau1846,Giac Mo Mua Dong             ,Thu Minh1847,Giac Mo Mua Thu              ,My Tam1848,Giac Mo Ngay Xua             ,Viet Quang1849,Giac Mo Nong Say             ,Thanh Thuy1850,Giac Mo Thoi Gian            ,Ngoc Huong1851,Giac Mo Tinh Yeu             ,My Tam1852,Giac Mo Tuyet Voi            ,Diem Lien1853,Giac Mo Tuyet Voi            ,Johnny Dung1854,Giac Mo Tuyet Voi            ,Lam Truong1855,Giac Mo Ve Em                ,Lam Truong1856,Giac Mo                      ,Pham Hong Anh1857,Giac Mo                      ,Vpop1858,Giac Mong Vien Du            ,Y Lan1859,Giac Ngu Co Don              ,Thanh Thanh1860,Giac Ngu Dau Moi             ,Ha Vy1861,Giai Thoat                   ,Dam Vinh Hung1862,Gian Hon 2                   ,Phi Nhung1863,Gian Hon 2                   ,The Vu1864,Gian Hon 2                   ,Truong Vu1865,Gian Hon                     ,Dang Truong Phat1866,Gian Hon                     ,Don Ho; Nguyen Hung; The Son1867,Gian Hon                     ,Hoang Son1868,Gian Hon                     ,Hung Cuong; Mai Le Huyen1869,Gian Hon                     ,Khanh Hoang1870,Gian Hon                     ,Quang Le1871,Gian Ma Thuong               ,Huong Lan1872,Gian Nhau Mat Vui            ,Hung Cuong; Mai Le Huyen1873,Gian Nhau Mot Tuan           ,Lam Gia Minh1874,Giang Cau 1                  ,Tai Linh Dinh Van1875,Giang Cau 2                  ,Thanh Huyen; Chung Tu Luu1876,Giang Cau                    ,Elvis Phuong; Huong Lan; Quang Binh; Trang Thanh Lan1877,Giang Cau                    ,Kha Tu; Ky Vuong1878,Giang Lan                    ,Y Lan1879,Giang Ngoc                   ,Lili Hue1880,Giang Ngoc                   ,Mat Ngoc1881,Giang Ngoc                   ,Ngoc Lan1882,Giang Sinh Hong              ,Vu Luan; Ha My1883,Giang Sinh Ky Niem           ,Bruce Doan1884,Giao Mua                     ,Quang Dung1885,Giat Mo Tuyet Voi            ,Lam Truong1886,Giat Mo                      ,Lam Truong1887,Giay Phut Chia Xa 2          ,Duy Manh1888,Giay Phut Chia Xa            ,Dam Vinh Hung1889,Giay Phut Chia Xa            ,Ly Hai1890,Giay Phut Cuoi Tuan          ,Hung Cuong; Mai Le Huyen1891,Giay Phut Ta Tu              ,Ha Vy1892,Giay Phut That Long          ,Lam Vu1893,Giet Nguoi Anh Yeu           ,Truong Duy1894,Giet Nguoi Anh Yeu           ,Truong Vu1895,Giet Nguoi Trong Mong        ,Le Toan1896,Giet Nguoi Trong Mong        ,Ngoc Lan1897,Giet Nguoi Trong Mong        ,Tuan Ngoc1898,Gio Anh Hua De Lam Gi        ,Luu Chi Vy1899,Gio Bac                      ,Cam Ly1900,Gio Co Don Thi Em Cung Nhu Toi,Quach Thanh Danh1901,Gio Danh Do Dua              ,Quang Linh1902,Gio Mat Trang Thanh          ,Tam Doan1903,Gio Mua Va Anh               ,Lam Thuy Van1904,Gio Mua Xuan Toi             ,Ho Le Thu; Bao Han1905,Gio Nui Mua Rung             ,Truong Vu1906,Gio Phut Cua Nhau            ,Thai Thao1907,Gio Sang Mua                 ,Tam Doan1908,Gio Thoi Ben Song            ,Huong Lan1909,Gio Thoi Ben Song            ,Ngoc Huyen1910,Gio Thoi Ben Song            ,Phi Nhung1911,Gio Ty Canh Ba               ,Nhu Quynh; Manh Quynh1912,Gio                          ,Khanh Ha1913,Gioi Han Nao Cho Chung Ta    ,Dam Vinh Hung1914,Giong An Giang               ,Hai Ly1915,Giong Ca Di Vang             ,Dalena Anh Khoa1916,Giong Ca Di Vang             ,Phi Nhung1917,Giong Ca Di Vang             ,Thai Chau1918,Giong Ca Di Vang             ,Tuan Vu1919,Giong Le                     ,Che Linh1920,Giong Song Ky Niem           ,Lam Thuy Van1921,Giong Song                   ,Anh Tu1922,Giot Buon Khong Ten          ,Tam Doan1923,Giot Buon                    ,Khanh Ha1924,Giot Ca Phe                  ,Don Ho1925,Giot Le Cho Ngan Sau         ,Khanh Ha1926,Giot Le Cho Ngan Sau         ,Tuan Ngoc1927,Giot Le Co Don               ,Ha Ngoc Van1928,Giot Le Dai Trang            ,Che Linh1929,Giot Le Dai Trang            ,Ngoc Son1930,Giot Le Dai Trang            ,Tuan Vu1931,Giot Le Sau                  ,Bruce Doan1932,Giot Le Sau                  ,Che Linh1933,Giot Le Sau                  ,Gia Linh1934,Giot Le Sau                  ,Thuy Hang1935,Giot Le Sau                  ,Uyen Trang1936,Giot Le Tinh                 ,Phi Nhung1937,Giot Le Trong Dem            ,Ngoc Ho1938,Giot Mau Chung Tinh          ,Ngoc Huyen; Che Thanh1939,Giot Mua Cuoi Thu            ,Thanh Ha1940,Giot Mua Dem                 ,Jenny Loan1941,Giot Mua Dem                 ,Truc Quyen1942,Giot Mua Goi Buon            ,Nha Thanh1943,Giot Mua Hay Giot Le Tinh    ,Thanh Ha1944,Giot Mua Thu                 ,Anh Minh; Thuy Huong1945,Giot Mua Thu                 ,Anh Tuyet1946,Giot Mua Thu                 ,Khanh Ha1947,Giot Mua Thu                 ,Nini Ha Vy1948,Giot Nang Ben Them           ,Bruce Doan1949,Giot Nang Ben Them           ,Hoang Son1950,Giot Nang Ben Them           ,Thanh Ha1951,Giot Nang Ben Them           ,Vu Khanh1952,Giot Nang Chieu Xua          ,Lam Truong1953,Giot Nang Hong               ,Thuy Tien1954,Giot Nuoc Mat Chay Nguoc     ,Philip Huy1955,Giot Nuoc Mat Cho Doi        ,Dam Vinh Hung1956,Giot Nuoc Mat Cho Doi        ,Luong Tung Quang1957,Giot Nuoc Mat Nga            ,Female1958,Giot Nuoc Mat Nga            ,Ngoc Lien1959,Giot Nuoc Mat Nga            ,Thai Thao1960,Giot Nuoc Mat Sau Cung       ,Nhat Kim Anh1961,Giot Nuoc Mat Tren Mi Mat    ,Sisi1962,Giot Nuoc Mat Vo Vong        ,Dam Vinh Hung1963,Giot Sau Trinh Nu            ,Ha Vy1964,Giot Sau Trinh Nu            ,Mong Ngoc1965,Giot Sau Trinh Nu            ,Truong Vu1966,Giot Sau Trong Mat Ai        ,Nha Thanh1967,Giot Sau Trong Mua           ,Thanh Truc1968,Giot Sau Trong Tim           ,Thanh Ha1969,Giot Suong Tren Mi Mat       ,Diem Lien1970,Giot Suong Tren Mi Mat       ,Lay Minh; Bao Han1971,Giot Tinh                    ,Ho Le Thu1972,Giu Doi Cho Nhau             ,Tuan Ngoc1973,Giu Lai Cho Au Tho           ,Nguyen Khang1974,Giu Mai Tinh Anh Trong Tim   ,Thu Minh1975,Giua Anh Va Nguoi Ay Em Chon Ai,Gia Huy1976,Giua Doi Mat Nai             ,Quang Dung1977,Giua Hai Con Duong           ,Ly Hai1978,Giua Hai Mua Mua Nang        ,Lam N Tien1979,Giua Hai Nguoi Tinh Torn Between 2 Lovers,Christiane1980,Go Cua Can Nha Ngoai O       ,Bang Tam; Dang The Luan1981,Go Cua Tinh Yeu              ,Mtv1982,Go Cua Tinh Yeu              ,Thanh Thuy1983,Go Cua Trai Tim              ,Manh Quynh1984,Go Cua Trai Tim              ,Quang Le1985,Go Cua Trai Tim              ,Quoc Dai1986,Go Cua Trai Tim              ,Truong Vu1987,Go Cua                       ,Manh Dinh1988,Go Cua                       ,Tam Doan1989,Go Cua                       ,The Vu1990,Go Cua                       ,Truong Vu1991,Go Cua                       ,Tuan Vu1992,Goa Phu Ngay Tho             ,Diem Lien; Minh Thong1993,Goc Pho Buon                 ,Minh Tuyet1994,Goc Pho Diu Dang             ,Yen Vy1995,Goc Pho Reu Xanh             ,Dam Vinh Hung1996,Goc Pho Reu Xanh             ,Hoang Nam1997,Goc Pho Reu Xanh             ,Nhat Trung1998,Goc Vang                     ,Hong Ngoc1999,Goi Anh Mua Xuan             ,Diem Lien2000,Goi Anh                      ,Diep Thanh Thanh2001,Goi Doi Mat Nai              ,Lam Truong2002,Goi Em La Doa Hoa Sau        ,Vu Khanh2003,Goi Giac Mo Xua              ,Anh Khoa; Gia Huy2004,Goi Giac Mo Xua              ,Quang Dung2005,Goi Giac Mo Xua              ,Thanh Ha2006,Goi Gio Cho May Ngan Bay     ,Hai Ly2007,Goi Nguoi Duoi Mo            ,Gia Huy2008,Goi Nguoi O Lai              ,Lam Gia Minh2009,Goi Nguoi Xa Voi             ,Don Ho2010,Goi Nguoi Yeu Dau            ,Man2011,Goi Nho Que Huong            ,Ngan Tuan; Nhu Hang2012,Goi Nho Que Huong            ,Nguyen Son2013,Goi Nho Que Huong            ,Phi Nhung2014,Goi Nho Que Huong            ,Thanh Tuyen2015,Goi Nho Que Huong            ,Truong Vu2016,Goi Nho                      ,Y Lan2017,Goi Ten Bon Mua              ,Thanh Mai2018,Goi Tinh Chim Quyen          ,Trong Phuc Ngoc Huyen2019,Goi Tinh Thiet Tha           ,Ngoc Hue2020,Goi Tinh Xua Thuc Day        ,Ngoc Ho2021,Goi Trao Trai Tim            ,Kenny Thai2022,Got Hong Phieu Du            ,Vu Khanh2023,Got Hong Thoi Het Phieu Luu  ,Man2024,Got Hong                     ,Dan Truong2025,Got Hong                     ,Lam Truong2026,Got Hong                     ,Ngoc Huyen; Vu Luan2027,Got Phieu Du                 ,Hung Cuong2028,Gui Doi Mat Nai              ,Hong Ngoc2029,Gui Doi Mat Nai              ,Xuan Phu; Hien Thuc2030,Gui Nguoi Duoi Mo            ,Gia Huy2031,Gui Nguoi Em Gai             ,Huy Mc2032,Gui Nguoi Em Gai             ,Tran T Ha2033,Gui Nguoi Toi Yeu            ,Cam Ly; Canh Han2034,Gui Niem Thuong Ve Hue       ,Khanh Hoang2035,Ha Buon                      ,Hong Truc2036,Ha Buon                      ,Phuong Diem Hanh2037,Ha Hong                      ,Lynda Trang Dai; Tommy Ngo2038,Ha Noi Dem Tro Gio           ,My Linh2039,Ha Noi Mua Vang Con Mua      ,Cam Van2040,Ha Noi Mua Vang Nhung Con Mua,La Suong Suong2041,Ha Noi Mua Vang Nhung Con Mua,Tran Thai Hoa2042,Ha Noi Mua Vang Nhung Con Mua,Tuan Ngoc2043,Ha Noi Mua Vang Nhung Con Mua,Vu Khanh2044,Ha Noi Ngay Thang Cu         ,Ngoc Ha2045,Ha Noi Ngay Thang Cu         ,Vu Khanh2046,Ha Thuong                    ,Ha Vy2047,Ha Thuong                    ,Man2048,Ha Thuong                    ,Tuan Canh2049,Ha Tien                      ,My Huyen2050,Ha Tien                      ,Ngoc Huyen2051,Ha Tien                      ,Thanh Tuyen2052,Ha Trang                     ,Female2053,Ha Trang                     ,Khanh Ly2054,Ha Trang                     ,Quang Dung2055,Ha Trang                     ,Si Si Thanh Ly2056,Ha Trang                     ,Tuan Ngoc2057,Hai Au Phi Xu                ,Tai Linh; Sy Ben; Mong Na2058,Hai Ban Tay Trang            ,Khanh Hoang2059,Hai Ban Tay Trang            ,Truong Vu2060,Hai Chiec Bong Co Don        ,Nguyen Hung; Luu Bich; Thien Kim2061,Hai Dua Gian Nhau            ,Lam Gia Minh2062,Hai Dua Gian Nhau            ,Phi Nhung; Manh Quynh2063,Hai Hoa Rung Cho Em          ,Che Linh2064,Hai Hoa Rung Cho Em          ,Thanh Thanh2065,Hai Hoa Rung Cho Em          ,Thien Trang; Che Linh2066,Hai Hoa Rung Cho Em          ,Truong Vu; Hong Truc2067,Hai Khia Canh Cuoc Doi       ,Lili Hue2068,Hai Khia Canh Tinh Yeu       ,Lay Minh; Thien Kim2069,Hai Ky Niem Mot Chuyen Di    ,Giao Linh2070,Hai Ky Niem Mot Chuyen Di    ,Hong Truc2071,Hai Ky Niem Mot Chuyen Di    ,Manh Quynh2072,Hai Ky Niem Mot Chuyen Di    ,Nhu Quynh2073,Hai Ky Niem Mot Chuyen Di    ,Thanh Thu2074,Hai Ky Niem Mot Chuyen Di    ,Truong Vu2075,Hai Loi Mong                 ,My Huyen2076,Hai Loi Mong                 ,Que Trang2077,Hai Mua Mua                  ,Bao Tuan2078,Hai Mua Mua                  ,Ngoc Dai2079,Hai Mua Mua                  ,Thanh Tuyen2080,Hai Mua Noel                 ,Manh Dinh; Nhu Quynh2081,Hai Muoi Bon Gio Phep        ,Thien Trang2082,Hai Muoi Bon Muoi            ,Tu Uyen2083,Hai Muoi Gio Phep            ,Truong Vu2084,Hai Muoi Nam Ben La          ,Thanh Ha2085,Hai Muoi Nam Tinh Cu         ,La Suong Suong2086,Hai Muoi Nam Tinh Cu         ,Ngoc Lan2087,Hai Muoi Nam Tinh Cu         ,Vu Khanh2088,Hai Muoi Nam Tinh Dep Mua Chom Chom,Truong Vu2089,Hai Muoi                     ,My Tam2090,Hai Ngoai Thuong Ca          ,Le Thu2091,Hai Phuong Troi Cach Biet    ,Thanh Thuy2092,Hai Trai Tim Vang            ,Lynda Trang Dai; Tommy Ngo2093,Hai Vi Sao Lac               ,Female2094,Hai Vi Sao Lac               ,Giao Linh2095,Hai Vi Sao Lac               ,Hong Truc2096,Ham Hiu Mot Minh             ,Nhu Quynh2097,Han Do Ban                   ,Bao Tuan2098,Han Do Ban                   ,Bruce Doan2099,Han Do Ban                   ,Tuan Vu2100,Han Mac Tu                   ,Dam Vinh Hung2101,Han Mac Tu                   ,Hoai Nam2102,Han Mac Tu                   ,Man2103,Han Mac Tu                   ,Thanh Thuy; Y Phung2104,Han Mac Tu                   ,Thanh Tuyen2105,Han Mac Tu                   ,Thuy Hang2106,Han Tha La                   ,Hong Truc2107,Han Tha La                   ,Quang Le2108,Han Tinh Trong Mua           ,Tu Quyen2109,Hang Be Lem                  ,Hop Ca2110,Hang Be Lem                  ,Man2111,Hanh Phuc Bat Chot           ,Ngoc Thuy2112,Hanh Phuc Cuoi               ,Dam Vinh Hung2113,Hanh Phuc Dau Xuan           ,Hoang Oanh; Trung Chinh2114,Hanh Phuc Doi Ta             ,Quang Binh; Trang Thanh Lan2115,Hanh Phuc Don So             ,Manh Quynh2116,Hanh Phuc Don So             ,Truong Vu2117,Hanh Phuc Lang Thang         ,Dam Vinh Hung2118,Hanh Phuc Lang Thang         ,Thai Chau2119,Hanh Phuc Lang Thang         ,Y Lan2120,Hanh Phuc Mang Theo          ,Y Lan2121,Hanh Phuc Mong Manh          ,Dam Vinh Hung2122,Hanh Phuc Mot Mua Xuan       ,Luong Tung Quang2123,Hanh Phuc Nua Voi            ,Dam Vinh Hung2124,Hanh Phuc Nua Voi            ,Huy Vu2125,Hanh Phuc Nua Voi            ,Kenny Thai2126,Hanh Phuc Nua Voi            ,Male2127,Hanh Phuc Quanh Day          ,Kha Tu2128,Hanh Phuc Thuong Dau         ,Truong Vu2129,Hanh Phuc Tram Nam           ,Phuong Hoang Chau2130,Hanh Phuc Trong Tam Tay      ,Luu Bich2131,Hanh Phuc Trong Tam Tay      ,Mong Ngoc2132,Hanh Phuc Van Con Day        ,Huong Lan2133,Hanh Trang Gia Tu            ,Nhu Quynh; Truong Vu2134,Hanh Trinh Tren Dat Phu Sa   ,Huong Thuy; Tam Doan2135,Hanh Trinh Tren Dat Phu Sa   ,Phi Nhung2136,Hao Hoa                      ,Kha Tu2137,Hao Hoa                      ,Trang Dai2138,Hat Ben Troi Lang Quen       ,My Tam2139,Hat Bien Tinh Yeu            ,Bang Kieu2140,Hat Cho Anh Va Mua Xuan      ,My Tam2141,Hat Cho Mai Sau              ,Truong Vu2142,Hat Cho Mang Dem             ,Bang Cuong2143,Hat Cho Mot Dong Song        ,Lam Hung2144,Hat Cho Ngay Hom Qua         ,Hop Ca2145,Hat Cho Nguoi Nam Xuong      ,Khanh Ly2146,Hat Cho Nguoi O Lai          ,Minh Tuyet2147,Hat Cho Nguoi O Lai          ,My Tam2148,Hat Cho Nguoi Ra Di          ,Bang Kieu; La Suong Suong2149,Hat Cho Nguoi Tinh Nho       ,Thanh Thanh2150,Hat Cho Nguoi Tinh Xa        ,Ngoc Anh2151,Hat Cho Nguoi Tinh           ,Che Linh2152,Hat Cho Nguoi Xa Nha         ,Luu Bich2153,Hat Cho Nguoi Yeu Dau        ,Man2154,Hat Hieu Tinh Buon           ,Nha Thanh2155,Hat Hiu Tinh Buon            ,Manh Quynh2156,Hat Lam Quen                 ,Mai Le Huyen2157,Hat Mua Va Noi Nho           ,Nguyen Khang2158,Hat Nua Di Em                ,Khanh Hoang2159,Hat Nua Di Em                ,Quoc Dai2160,Hat Nua Di Em                ,Truong Duy2161,Hat Nua Di Em                ,Truong Vu2162,Hat Ru Tinh Doi              ,Ngoc Son2163,Hat Ru Tinh Doi              ,Nha Thanh2164,Hat Ru Tinh Doi              ,Thai Chau2165,Hat Suong Tren La            ,Lam Truong2166,Hat Tham                     ,My Linh2167,Hat Voi Chu Ve Con           ,Bang Kieu2168,Hat Voi Dong Song            ,Diem Lien2169,Hay Cho Em Ngay Mai          ,The Bell Band2170,Hay Cho Toi                  ,Nguyen Hung2171,Hay Dat Em Ve                ,Ngoc Huong2172,Hay De Em Ra Di              ,Phuong Thanh2173,Hay De Mua Roi               ,Cam Van; Khac Trieu2174,Hay De Mua Roi               ,Dan Truong2175,Hay De Mua Roi               ,Ly Hai2176,Hay De Mua Roi               ,Ngoc Thuy2177,Hay De Mua Roi               ,Tran Thai Hoa2178,Hay De Tinh Ngu Yen          ,Minh Tuyet2179,Hay Den Ben Chang            ,Trizzie Phuong Trinh2180,Hay Den Ben Em               ,Jacquelin Thuy Tram2181,Hay Den Day Dem Nay          ,Dam Vinh Hung2182,Hay Khoc Di Em               ,Vu Khanh2183,Hay La Anh Da Quen Em        ,Mong Ngoc2184,Hay Mang Den Nhung Mua Xuan  ,Ly Hai2185,Hay Mang Den Nhung Mua Xuan  ,Nguyen Hung2186,Hay Mang Den Nhung Mua Xuan  ,Quang Dung2187,Hay Mang Niem Vui Toi        ,Tu Quyen2188,Hay Nghe Anh Mot Lan         ,Nhat Thuc Band2189,Hay Ngoi Xuong Day           ,Le Uyen Phuong2190,Hay Nhin Ve Tuong Lai        ,Phan Dinh Tung2191,Hay Nho Mai                  ,Le Tam2192,Hay Noi Loi Yeu              ,Johnny Dung2193,Hay Noi Loi Yeu              ,Thanh Thuy2194,Hay Noi Mot Loi              ,Tuan Viet2195,Hay Noi Voi Em               ,Bang Kieu2196,Hay Noi Voi Em               ,Hong Ngoc2197,Hay Noi Voi Em               ,My Tam2198,Hay Noi Yeu Em Dem Nay       ,Luu Bich2199,Hay O Day Dem Nay            ,Dam Vinh Hung2200,Hay Quen Anh Dem Nay         ,Chung Tu Luu2201,Hay Quen Nhau                ,Phi Nhung2202,Hay Quen Nhau                ,Tam Doan2203,Hay Quen Toi Di              ,Elvis Phuong2204,Hay Song Cung Tinh Yeu       ,Bao Han; Nhu Loan2205,Hay Song Nhu Moi Nguoi       ,Bao Han; Trang Dai2206,Hay Song That Long           ,Dam Vinh Hung2207,Hay Tha Thu Cho Em           ,Lam Thuy Van2208,Hay Tha Thu Cho Em           ,My Tam2209,Hay Twist Cho Dem Nay        ,Quoc Hung2210,Hay Ve Day Ben Anh           ,Duy Manh2211,Hay Ve Day Ben Anh           ,Gia Huy2212,Hay Ve Voi Anh               ,Nguyen Khang2213,Hay Ve Voi Em                ,Thien Kim2214,Hay Vui Dem Nay              ,Kieu Nga2215,Hay Yeu Nhau Di              ,Thuy Hang2216,Hay Yeu Nhau Nhu Chua Yeu Lan Nao,Female2217,Hay Yeu Nhu Chua Yeu Lan Nao ,Don Ho; Doanh Doanh2218,Hay Yeu Nhu Chua Yeu Lan Nao ,Thanh Ha2219,He Muon                      ,Bang Kieu2220,Hen Ho Dem Trang             ,Manh Dinh; Nhu Quynh2221,Hen Ho                       ,Thuy Duong2222,Hen Ho                       ,Tuan Ngoc2223,Hen Nhau Cuoi Tuan           ,Female2224,Hen Nhau Cuoi Tuan           ,Manh Quynh; Que Trang2225,Hen Nhau Cuoi Tuan           ,Song Ca2226,Hen Nhau Nam 2000            ,Hop Ca2227,Hien Chuong Tinh Yeu         ,Le Tam2228,Hien Chuong Yeu              ,Tuan Ngoc2229,Hinh Anh Nguoi Em Khong Doi  ,Son Ca2230,Hinh Anh Nguoi Khong Doi     ,Thuy Tram2231,Hinh Bong Cu                 ,Lam Gia Minh2232,Hinh Bong Nguoi Yeu          ,Quoc Dai2233,Hinh Bong Que Nha            ,Huong Lan2234,Hinh Bong Que Nha            ,Khanh Hoang2235,Hinh Bong Que Nha            ,Manh Quynh; Huong Thuy2236,Hinh Bong Que Nha            ,Tuan Vu2237,Hiu Hat Doi Nhau             ,Luu Bich2238,Ho Am Ngay Ngay Xua          ,My Tam2239,Ho Lo                        ,Y Lan2240,Ho Thu                       ,Son Ca2241,Hoa Bien                     ,Gia Huy2242,Hoa Bien                     ,Khai Tuan; Da Nhat Yen2243,Hoa Bien                     ,Man2244,Hoa Bien                     ,Manh Dinh2245,Hoa Binh Oi Viet Nam Oi      ,Trung Chinh; Phuong Dung; Doanh Doanh2246,Hoa Buom Ngay Xua            ,Tran Thai Hoa; Nhu Quynh2247,Hoa Cai Mai Toc              ,Man2248,Hoa Cau Vuon Trau            ,Vu Luan; Tam Tam2249,Hoa Co Mua Xuan              ,Tik Tik Tac2250,Hoa Co Vang Noi Ay           ,Dam Vinh Hung2251,Hoa Co Vang Noi Ay           ,Quang Dung2252,Hoa Dao Nam Truoc            ,Phuong Hong Hanh2253,Hoa Hoc Tro                  ,Dam Vinh Hung2254,Hoa Hoc Tro                  ,Duy Quang; Ngoc Minh2255,Hoa Hoc Tro                  ,Kieu Nga2256,Hoa Hoc Tro                  ,Le Toan2257,Hoa Hoc Tro                  ,Phi Nhung2258,Hoa Hong Mot Doa             ,Nguyen Hung2259,Hoa Hong Mua Xuan            ,Quoc Kiet; Trinh Trinh2260,Hoa Muoi Gio                 ,Hoang Lan2261,Hoa Muoi Gio                 ,Que Trang2262,Hoa Muoi Gio                 ,Tuan Vu2263,Hoa No Ve Dem                ,Thanh Tuyen2264,Hoa Soan Ben Them Cu         ,Man2265,Hoa Soan Ben Them Cu         ,Thanh Lan