4463,Thien Duyen Tien Dinh        ,Phillip Huy; Shayla4464,Thien Thai                   ,Khanh Lan4465,Thien Thai                   ,Lam Nhat Tien4466,Thien Than Mu Do             ,Hung Cuong4467,Thien Than Toi Loi           ,Sy Dan4468,Thien Than Tuyet             ,Vi Oanh4469,Thiep Hong Bao Tin           ,Hong Truc4470,Thiep Hong Bao Tin           ,Truong Vu4471,Tho Chay Hon Toi Net Ten Em  ,Vu Khanh4472,Tho Ngay                     ,Da Nhat Yen4473,Tho Ta Chia Tay              ,Van Quang Long4474,Tho Than                     ,Che Phong4475,Thoang May Bay               ,Thai Chau4476,Thoang May Bay               ,Thao My4477,Thoang Mot Giac Mo           ,Tam Doan4478,Thoat Ly                     ,My Tam4479,Thoat Ly                     ,Quoc Dung4480,Thoi Anh Hay Ve              ,Dan Huy4481,Thoi Anh Hay Ve              ,Female4482,Thoi Anh Hay Ve              ,La Suong Suong4483,Thoi Anh Hay Ve              ,Lam Truong; Thu Phuong4484,Thoi Anh Hay Ve              ,Minh Tuyet; Johnny Dung4485,Thoi Anh Hay Ve              ,Thanh Thuy; Anh Tu4486,Thoi Danh Chia Tay           ,Ly Hai4487,Thoi Doi                     ,Manh Dinh4488,Thoi Doi                     ,Nguyen Hung; Don Ho4489,Thoi Ta Chia Tay             ,Van Quang Long4490,Thoi Ta Xa Nhau              ,Man4491,Thoi To                      ,Christine Le4492,Thoi To                      ,Y Lan4493,Thoi                         ,Man4494,Thoi                         ,Manh Quynh4495,Thu Chien Binh               ,Truong Vu4496,Thu Cho Vo Hien              ,Quang Le4497,Thu Cho Vo Hien              ,Truong Vu4498,Thu Cuoi Hong                ,Sy Long4499,Thu Cuoi                     ,Van Quang Long4500,Thu Dau Thuong               ,Kenny Thai4501,Thu Gui Nguoi Buon Xa        ,Hong Truc4502,Thu Nguoi Con Gai Thanh Do   ,Tuan Vu4503,Thu Quyen Ru                 ,Le Toan4504,Thu Sau Lay Troi Con Duoc Binh Yen,Y Lan4505,Thu Sau                      ,Dinh Vu4506,Thu Sau                      ,Yen Phuong4507,Thu Tha Mot Nguoi            ,Dam Vinh Hung4508,Thu Vang Tren Loi            ,Ngoc Hue4509,Thu Vang                     ,Female4510,Thu Vang                     ,Hong Nhung4511,Thu Vang                     ,Thanh Lan4512,Thu Ve Em Gai Thanh Do       ,Che Linh4513,Thu Ve Xom Nho               ,Khanh Hoang4514,Thu Xuan Hai Ngoai           ,Gia Huy4515,Thu Xuan Tren Rung Cao       ,Quang Le4516,Thua Ay Co Em                ,Ky Vuong4517,Thua Mot Tinh Yeu            ,Nhat Kim Anh4518,Thung Lung Hong              ,Khanh Ly4519,Thung Lung Hong              ,Y Lan4520,Thuo Ay Co Em                ,Ky Vuong4521,Thuo Ay Co Em                ,Tran Thai Hoa4522,Thuo Ban Dau                 ,Alan Ai4523,Thuo Ban Dau                 ,Bruce Doan4524,Thuo Ban Dau                 ,Mong Thi4525,Thuo Ban Dau                 ,Quang Linh4526,Thuo Ban Dau                 ,Vu Khanh4527,Thuo Hai Muoi                ,My Tam4528,Thuong Ai Mat Doi Mat Cho    ,Phi Nhung4529,Thuong Ao Ba Ba              ,Cam Ly4530,Thuong Ca Mua Ha             ,Minh Tuyet4531,Thuong Chiec Ao Ba Ba        ,Phi Nhung4532,Thuong Doi Hoa               ,Female4533,Thuong Han                   ,Che Linh4534,Thuong Han                   ,Thanh Thanh4535,Thuong Hoai Ngan Nam         ,Bao Ngoc4536,Thuong Hoai Ngan Nam         ,Dam Vinh Hung4537,Thuong Hoai Ngan Nam         ,Phuong Diem Hanh4538,Thuong Mot Nguoi O Xa        ,Manh Quynh4539,Thuong Mot Nguoi             ,Truc Quynh4540,Thuong Mot Nguoi             ,Y Lan4541,Thuong Nhau Ly To Hong       ,Nha Thanh4542,Thuong Nhau Ly To Hong       ,Quang Linh; Cam Ly4543,Thuong Nhau Mua He           ,Trizzie Phuong Trinh4544,Thuong Nhau Ngay Mua         ,Lam Thuy Van4545,Thuong Nhau Ngay Mua         ,Le Tri4546,Thuong Nhau Ngay Mua         ,Tuan Ngoc; Thai Thao4547,Thuong Nhau Ngay Xua         ,Quang Dung4548,Thuong Nhau Tron Doi         ,Manh Quynh4549,Thuong Nho Que Nha           ,Bruce Doan; Kha Tu4550,Thuong Nho Que Nha           ,Phi Nhung4551,Thuong Nho Trong Mua         ,Ngoc Bich4552,Thuong Nho                   ,Huong Lan4553,Thuong Qua Viet Nam          ,Quang Linh4554,Thuong Sao Chiec Non Bai Tho ,Truong Vu4555,Thuong Tham                  ,Tuong Nguyen4556,Thuong Tinh Nhan             ,Hoai Nam4557,Thuong Tinh Nhan             ,Ngoc Ho4558,Thuong Ve Me Hue             ,My Huyen4559,Thuong Ve Mien Dat Lanh      ,Huong Lan4560,Thuong Ve Mien Dat Lanh      ,Quang Linh4561,Thuong Ve Mien Dong Bien Gioi,Truong Vu4562,Thuong Ve Mien Trung         ,Hong Truc4563,Thuong Ve Mien Trung         ,Nhu Quynh4564,Thuong Ve Mien Trung         ,Quang Le4565,Thuong Ve Mien Trung         ,Quang Linh4566,Thuong Ve Mien Trung         ,Thuy Duong4567,Thuong Ve Quan Tro           ,Truong Vu4568,Thuong Ve Que Toi            ,Manh Dinh4569,Thuong Ve Su Hue             ,My Le4570,Thuong Ve Vung Hoa Tuyen     ,Hong Truc4571,Thuong Ve Xu Hue             ,My Le4572,Thuong Ve Xu Hue             ,Thuy Duong4573,Thuong                       ,Y Lan4574,Thuy Da Di Roi               ,Nguyen Hung4575,Thuy Thu Va Bien Ca          ,Le Tam4576,Thuyen Giay Chieu Mua        ,Hoai Nam4577,Thuyen Hoa                   ,Kha Tu; Bruce Doan4578,Thuyen Tinh Tren Song        ,Don Ho; Ngoc Hue4579,Thuyen Trang                 ,Anh Tu4580,Thuyen Vien Xu               ,Christiane Le4581,Thuyen Vien Xu               ,Duy Hanh4582,Thuyen Xa Ben Do             ,Mong Ngoc4583,Thuyen Xa Ben Do             ,Ngoc Ho4584,Tia Nang Duoi Mua            ,Tu Quyen4585,Tiec Lam Gi                  ,Thien Kim4586,Tiec Nuoi Cuoc Tinh          ,Chau Ngoc4587,Tiec Nuoi                    ,Y Lan4588,Tiec Thu                     ,Hoa Mi4589,Tiec Thuong                  ,Axn4590,Tiec Thuong                  ,Diem Lien; Lay Minh4591,Tiec                         ,Bruce Doan4592,Tien Anh Chieu Mua           ,Huy Tam4593,Tien Anh Trong Mua           ,Christiane Le4594,Tien Ban Len Duong           ,Lam Truong4595,Tien Biet                    ,Huong Lan4596,Tien Biet                    ,My Hao; Ky Vuong4597,Tien Biet                    ,Tuan Vu4598,Tien Buoc Sang Ngang         ,Female4599,Tien Dua                     ,Dam Vinh Hung4600,Tien Dua                     ,Hong Truc4601,Tien Dua                     ,Lam Hung4602,Tien Dua                     ,Phi Nhung4603,Tien Dua                     ,Quang Linh4604,Tien Dua                     ,Vu Khanh4605,Tien Dua                     ,Y Lan4606,Tien Em Chieu Mua            ,Y Lan4607,Tien Em Noi Phi Truong       ,Man4608,Tien Em Theo Chong           ,Truong Vu4609,Tien Em Trong Mua            ,Duy Hanh4610,Tien Em                      ,Le Tri4611,Tien Mot Nguoi Di            ,Ngoc Dan Thanh4612,Tien Nguoi Di                ,Giao Linh4613,Tien Thoai Luong Nan         ,Bao Phuc4614,Tien                         ,The Son4615,Tieng Ca Do Ve Dau           ,Lam Gia Minh4616,Tieng Ca Do Ve Dau           ,Truong Vu4617,Tieng Chim Quyen             ,Cam Ly4618,Tieng Chuong Giang Sinh      ,Cat Tien4619,Tieng Dan Chai               ,Ac & M4620,Tieng Dan Tinh Yeu           ,Ho Quynh Huong4621,Tieng Gio Xon Xao            ,Dam Vinh Hung4622,Tieng Gio Xon Xao            ,Huy Vu; Tu Quyen4623,Tieng Hat Chim Da Da         ,Don Ho4624,Tieng Hat Chim Da Da         ,Quang Le4625,Tieng Hat Chim Da Da         ,Quang Linh4626,Tieng Hat Chim Da Da         ,Truc Quyen4627,Tieng Hat Da Lan             ,Khanh Ly4628,Tieng Hat Hau Phuong         ,Female4629,Tieng Hat Muong Luong        ,Phi Nhung4630,Tieng Hat Nua Voi            ,Female4631,Tieng Hat Sao Dem            ,Vu Khanh4632,Tieng Hat Trai Tim           ,Hop Ca4633,Tieng Hat Tu Nhip Tim        ,Tu Quyen; Loan Chau; Nhu Loan; Rebecca Quynh Giao4634,Tieng Hat Voi Cung Dan       ,Elvis Phuong; Duy Quang; Ai Van; Phi Khanh4635,Tieng Ho Mien Nam            ,Female4636,Tieng Ho Mien Nam            ,Phi Nhung4637,Tieng Long Ni Non            ,Tam Doan4638,Tieng Long Ni Non            ,Thanh Huyen4639,Tieng Long Xao Dong          ,My Tam4640,Tieng Mua Buon               ,Ngoc Lan4641,Tieng Mua Dem                ,Duy Quang4642,Tieng Quoc Dem Trang         ,Nha Thanh4643,Tieng Rao                    ,Huynh Phong Dien4644,Tieng Rao                    ,Minh Tuyet4645,Tieng Sao Phieu Bong         ,Lam Truong4646,Tieng Sao Thien Thai         ,Christiane Le; Le Tri4647,Tieng Sao Thien Thai         ,Female4648,Tieng Sao Thien Thai         ,Thanh Ha4649,Tieng Sao                    ,Cam Ly4650,Tieng Set Noi Vuon Hoang     ,Ngoc Anh4651,Tieng Song Bien              ,Tai Linh; Mong Na4652,Tieng Song Huong             ,Ngoc Ha4653,Tieng Thoi Gian              ,Le Dung4654,Tieng Vi Cam                 ,Minh Tuyet4655,Tieng Xua                    ,Ngoc Dai4656,Tieng Xua                    ,Thanh Thuy4657,Tieng Yeu Mua Dong           ,Hong Ngoc4658,Tieu Can 1 Khuc Dan Ca       ,Tuong Nguyen4659,Tieu Co Nuong                ,Manh Dinh4660,Tieu Khuc Cho Em             ,Lam Truong4661,Tim Anh                      ,Hoang Lan4662,Tim Ban Bon Phuong           ,Thai Chau4663,Tim Bong                     ,Quang Dung4664,Tim Ca Rung Chieu            ,Hong Truc4665,Tim Ca Rung Chieu            ,Truong Vu4666,Tim Dau Giac Mo              ,My Tam4667,Tim Dau Ngay Tho             ,Truong Vu4668,Tim Dau                      ,Tuan Ngoc4669,Tim Lai Lan Nua              ,Female4670,Tim Lai Lan Nua              ,Minh Vi4671,Tim Lai Lan Nua              ,Vu Quoc Viet4672,Tim Quen                     ,Truong Vu4673,Tim Ve Chon Cu               ,Loan Chau; Truc Linh; Truc Lam4674,Tim Ve Chon Hoang Vu         ,Tuan Ngoc4675,Tim Ve Dau Yeu               ,Hoang Nam4676,Tim Ve Ngay Hom Qua          ,Phan Dinh Tung4677,Tim Ve Pho Xua               ,Female4678,Tim Ve Pho Xua               ,Hop Ca4679,Tim Vo                       ,Nhu Quynh; Don Ho4680,Tinh 2000                    ,Dam Vinh Hung4681,Tinh 2000                    ,Diem Lien4682,Tinh Anh Linh Chien          ,Le Tri4683,Tinh Anh Linh Chien          ,Truong Vu4684,Tinh Anh Ngon Nen            ,Anh Tu4685,Tinh Anh Van Nhu The         ,Nhat Tinh Anh4686,Tinh Anh                     ,Hoang Nam4687,Tinh Bac                     ,Ngoc Ho4688,Tinh Ban Quang Trung         ,Truong Vu; Lam Gia Minh4689,Tinh Ban                     ,Lam Truong4690,Tinh Ban                     ,Phuong Hung4691,Tinh Ban                     ,Phuong Uyen4692,Tinh Bang Gia                ,Nguyen Hung; Nhu Quynh4693,Tinh Bang Gia                ,Nguyen Khuong4694,Tinh Bo Vo                   ,Bruce Doan; Giao Linh4695,Tinh Bo Vo                   ,Song Ca4696,Tinh Bo Vo                   ,Tuan Vu4697,Tinh Bot Nuoc                ,Quoc Dai4698,Tinh Buon Trong Mua          ,The Son4699,Tinh Buon                    ,Vanhat Truong4700,Tinh Ca Alisan               ,Thai Doanh Doanh4701,Tinh Ca Chim Da Da           ,Phi Nhung4702,Tinh Ca Du Muc               ,Ngoc Bich4703,Tinh Ca Mua Dong             ,Uyen Phuong4704,Tinh Ca Mua Ha               ,Vu Tuan4705,Tinh Ca Muon Doi             ,Female4706,Tinh Ca Muon Thuo            ,Man4707,Tinh Ca Shalala              ,Kevin Khoa4708,Tinh Ca Tren Lua             ,Manh Quynh; Thuy Hang4709,Tinh Ca                      ,Hop Ca4710,Tinh Ca                      ,Son Ca4711,Tinh Cam                     ,Duy Linh4712,Tinh Cam                     ,Vu Khanh4713,Tinh Cay Dang                ,Johny Dung4714,Tinh Cay Va Dat              ,Ha Vy4715,Tinh Cay Va Dat              ,Tam Doan4716,Tinh Cha                     ,Dang Truong Phat4717,Tinh Cha                     ,Ngoc Son4718,Tinh Cha                     ,Quang Le4719,Tinh Chang Y Thiep           ,Hong Truc4720,Tinh Chang Y Thiep           ,Thanh Tuyen4721,Tinh Chang Y Thiep           ,Truong Vu4722,Tinh Chang Y Thiep           ,Y Van; Huong Lan4723,Tinh Chap Nhan               ,Thieu Ky Anh4724,Tinh Chet Theo Mua Dong      ,Bruce Doan4725,Tinh Chet Theo Mua Dong      ,Elvis Phuong4726,Tinh Chi Dep Khi Con Dang Do ,Thanh Tuyen4727,Tinh Cho Khong Biet Khong    ,Tu Quyen4728,Tinh Cho Khong Bieu Khong    ,Man4729,Tinh Cho Khong Bieu Khong    ,Nguyen Hung; Ky Duyen4730,Tinh Chot Den                ,Lam Thai Uyen4731,Tinh Co Gap Nhau             ,Do Thanh4732,Tinh Co Gap Nhau             ,Hoai Nam4733,Tinh Co Gap Nhau             ,Nha Thanh4734,Tinh Co Gap Nhau             ,Phi Nhung4735,Tinh Co Nhu Khong            ,Mai Le Huyen; Anh Minh4736,Tinh Co Nhu Khong            ,Man4737,Tinh Co                      ,Female4738,Tinh Co                      ,Huy Son Huy Nhat4739,Tinh Co                      ,Ngoc Bich4740,Tinh Co                      ,Phi Nhung4741,Tinh Co                      ,Tien Dung4742,Tinh Cuoi Xot Xa             ,Huy Tam4743,Tinh Cuoi Xot Xa             ,Vu Khanh; Thanh Ha4744,Tinh Cuong Say               ,Andy Quach4745,Tinh Cuong Say               ,Lam Chi Khanh4746,Tinh Cuong Si                ,Huy Tam4747,Tinh Da Bay Xa               ,Truc Quyen4748,Tinh Da Lang Quen            ,Cat Tien4749,Tinh Da Nhat Mo              ,Nguyen Thang4750,Tinh Da Vut Bay              ,Tuan Ngoc4751,Tinh Da Vut Bay              ,Vu Tuan Duc4752,Tinh Da Xa 2                 ,Minh Tuyet4753,Tinh Da Xa                   ,Don Ho4754,Tinh Dai Kho                 ,Truong Vu4755,Tinh Dang Ly Kho Qua         ,Nha Thanh4756,Tinh Dang Ly Kho Qua         ,Tam Doan4757,Tinh Dau Chua Nguoi          ,Minh Tuyet4758,Tinh Dau Chua Nguoi          ,Trinh Nam Son4759,Tinh Dau De Quen             ,Lam Thuy Van4760,Tinh Dau Kho Phai            ,Lam Thuy Van4761,Tinh Dau Mai Yeu             ,Huy Vu4762,Tinh Dau Mot Thoi Ao Trang   ,Diem Lien; Y Phuong; Y Phung4763,Tinh Dau Mot Thoi Ao Trang   ,Duet4764,Tinh Dau Tinh Cuoi           ,Don Ho4765,Tinh Dau Tinh Cuoi           ,Man4766,Tinh Dau Tinh Cuoi           ,Quang Dung4767,Tinh Dau Van Vuong           ,Thanh Truc4768,Tinh Dau                     ,Duc Hai4769,Tinh Dau                     ,Purity4770,Tinh Dau                     ,Van Quang Long4771,Tinh Den Roi Di              ,Thanh Truc4772,Tinh Den Trai Tim            ,Hai Mi4773,Tinh Dep Mua Chom Chom       ,Truong Vu4774,Tinh Dep Nhu Mo              ,Man4775,Tinh Dep Nhu Mo              ,Thanh Ha4776,Tinh Dep Xot Xa              ,Thanh Truc4777,Tinh Dep                     ,Thanh Truc; Gia Huy4778,Tinh Dien                    ,Huy Tam4779,Tinh Doi Ca Si               ,Luu Bich4780,Tinh Doi Nghe Si             ,Dam Vinh Hung4781,Tinh Doi Nghe Si             ,Diem Lien4782,Tinh Doi Tay Trang           ,Truong Vu4783,Tinh Doi                     ,Man4784,Tinh Doi                     ,Thanh Tuyen4785,Tinh Doi                     ,Thien Kim; Lam Nhat Tien; Minh Thong4786,Tinh Don Coi                 ,Minh Tuyet4787,Tinh Don Coi                 ,Nguyen Khang4788,Tinh Don Phuong              ,Dan Huy4789,Tinh Don Phuong              ,Dan Truong4790,Tinh Don Phuong              ,Lam Truong4791,Tinh Don Phuong              ,Nguyen Khuong4792,Tinh Em Bien Rong Song Dai   ,Quang Le4793,Tinh Em Bien Rong Song Dai   ,Truong Vu4794,Tinh Em Bup Be               ,Lam Gia Minh4795,Tinh Em Con Mai              ,Tu Quyen4796,Tinh Em La Dai Duong         ,Duy Manh4797,Tinh Em Mai Trao             ,Thu Minh4798,Tinh Em Mua Xuan             ,Lam Truong4799,Tinh Em Mua Xuan             ,Nhat Trung; La Suong Suong4800,Tinh Em Mua Xuan             ,Truong Huy4801,Tinh Em Ngon Nen             ,Minh Nhi4802,Tinh Em Ngon Nen             ,My Tam4803,Tinh Em Sa Mac               ,Cam Ly4804,Tinh Em Trao Anh             ,Ngoc Thuy4805,Tinh Em Trao Anh             ,Nini Uyen My4806,Tinh Gan Tinh Xa             ,Ngoc Son4807,Tinh Ghen                    ,Julie4808,Tinh Gian Doi Nguoi Gian Doi ,Luu Chi Vy4809,Tinh Giua Doi Bo             ,Vu Ha4810,Tinh Hoai Huong              ,Ngoc Ha4811,Tinh Hoang Hon               ,Phuong Thanh4812,Tinh Hong Nhu Mo             ,Cam Ly; Dan Truong4813,Tinh Hong Nhu Mo             ,Minh Vi4814,Tinh Hong                    ,Lam Truong; Thuy Tien4815,Tinh Kho (Tro Ve Pho Cu)     ,Minh Tuyet4816,Tinh Khong Doi Thay          ,Nguyen Hung4817,Tinh Khong Hoi Tiec          ,Uyen Trang4818,Tinh Khuc Buon               ,Carol Kim4819,Tinh Khuc Buon               ,Don Ho4820,Tinh Khuc Buon               ,Man4821,Tinh Khuc Buon               ,Vu Khanh4822,Tinh Khuc Chieu Mau          ,Bang Kieu; Tran Thai Hoa4823,Tinh Khuc Chieu Mua          ,Thanh Truc4824,Tinh Khuc Cho Em             ,Bruce Doan; Anh Thu4825,Tinh Khuc Cho Em             ,Dam Vinh Hung4826,Tinh Khuc Cho Em             ,Nhu Quynh; Loan Chau4827,Tinh Khuc Dem Trang          ,Ngoc Huong4828,Tinh Khuc Doan Truong        ,Truong Vu4829,Tinh Khuc Doi Gian           ,Thanh Thuy4830,Tinh Khuc Mua Dong           ,Nhat Trung4831,Tinh Khuc Mua Xuan           ,Dinh Ngoc4832,Tinh Khuc Mua Xuan           ,Tuan Ngoc4833,Tinh Khuc Thang Sau          ,Khanh Ha4834,Tinh Khuc Thu Nhat           ,Le Uyen4835,Tinh Khuc Thu Nhat           ,Vu Khanh4836,Tinh Khuc Thu Nhut           ,Tran Duc4837,Tinh Ky Nu                   ,Man4838,Tinh Ky Nu                   ,Manh Quynh4839,Tinh La Con Mo               ,Anh Tu4840,Tinh La Gi                   ,Thien Kim4841,Tinh La Gi                   ,Tuan Hung4842,Tinh La Giac Mo              ,Khanh Ha4843,Tinh La Soi To               ,Ninh Cat; Loan Chau4844,Tinh La The Do               ,Don Ho4845,Tinh Lam Lo                  ,Lam Truong; Cam Ly4846,Tinh Lam Lo                  ,Lam Truong; Chau Khanh4847,Tinh Lam Lo                  ,Ngoc Lan4848,Tinh Lam Lo                  ,Nguyen Khang4849,Tinh Lang Tu                 ,Truong Vu4850,Tinh Le Bong                 ,Tu Quyen4851,Tinh Le Loi                  ,Lam Thuy Van4852,Tinh Linh                    ,Hung Cuong4853,Tinh Linh                    ,Man4854,Tinh Lo Cach Xa              ,Minh Tuyet4855,Tinh Lo Tram Nam             ,Nguyen Hung; Ai Van4856,Tinh Lo                      ,Dam Vinh Hung4857,Tinh Lo                      ,Sisi Thanh Ly4858,Tinh Lua Duyen Trang         ,Female4859,Tinh Mai Bay Xa              ,Kevin Khoa4860,Tinh Mai Ben Anh             ,Tu Quyen4861,Tinh Me                      ,Ngoc Son4862,Tinh Menh Mang               ,Dan Truong4863,Tinh Menh Mang               ,Nguyen Khuong4864,Tinh Mua Hoa Dao             ,Huong Lan4865,Tinh Muon                    ,Thanh Truc4866,Tinh Muon                    ,The Son4867,Tinh Nay                     ,Dam Vinh Hung4868,Tinh Ngan Doi Bo             ,Hong Truc4869,Tinh Nghe Si                 ,Hang Nga4870,Tinh Ngheo Co Nhau           ,Truong Vu; Quan Kim Thuy4871,Tinh Ngheo                   ,My Huyen4872,Tinh Ngheo                   ,Song Ca4873,Tinh Nghia Doi Ta            ,Huyen Chau4874,Tinh Nghia Doi Ta            ,Tri Christian4875,Tinh Nghia Doi Ta            ,Vu Khanh; Y Lan4876,Tinh Ngo Tram Nam            ,Luong Tung Quang; Tu Quyen4877,Tinh Nhat Phai               ,Don Ho4878,Tinh Nho Mau Quen            ,Khanh Hoang4879,Tinh Nho Mau Quen            ,Ngoc Son4880,Tinh Nho Mau Quen            ,Quang Le; Huong Thuy4881,Tinh Nho Mau Quen            ,Tam Doan4882,Tinh Nho                     ,Thien Kim4883,Tinh Nhu Chiec La            ,Van Quang Long4884,Tinh Nhu Chiem Bao           ,Uyen Trang; Duy Manh4885,Tinh Nhu Con Gio             ,La Suong Suong4886,Tinh Nhu Giac Mong Tan       ,Lam Truong4887,Tinh Nhu Giac Mong Tan       ,Minh Tuyet4888,Tinh Nhu May Khoi            ,Man4889,Tinh Nhu Ngon Nen            ,My Tam4890,Tinh Nong Chay               ,Female4891,Tinh Nong Say                ,Tuan Hung; Thanh Thao4892,Tinh Nong                    ,Thanh Thuy4893,Tinh Nuoi Tiec               ,Dam Vinh Hung4894,Tinh Nuoi Tiec               ,Nguyen Khang4895,Tinh Oi Em Cho               ,Vina Uyen My4896,Tinh Oi Vinh Biet            ,Chung Tu Luu4897,Tinh Oi Xin Ngu Yen          ,Dam Vinh Hung4898,Tinh Oi Xin Ngu Yen          ,Minh Tuyet4899,Tinh Oi Xin Ngu Yeu          ,Dam Vinh Hung4900,Tinh Oi                      ,Bao Han4901,Tinh Oi                      ,Quang Dung4902,Tinh Phai                    ,Lam Truong4903,Tinh Phai                    ,Lynda Trang Dai4904,Tinh Phai                    ,Tam Doan4905,Tinh Phieu Lang              ,The Son; Loan Chau4906,Tinh Phu                     ,Hai Ly4907,Tinh Phu                     ,Man4908,Tinh Quay Got                ,Dan Truong4909,Tinh Quay Got                ,Huy Tam4910,Tinh Que Huong               ,Cao Minh4911,Tinh Quyen Luyen             ,Man4912,Tinh Ra Di Nguoi Chang Muon Chia Ly,Pham Khanh Hung4913,Tinh Sau                     ,Lili Hue4914,Tinh Sau                     ,Nhu Mai4915,Tinh Say                     ,Cat Tien4916,Tinh Si                      ,Male4917,Tinh Si                      ,Thanh Ha4918,Tinh Si                      ,Tu Quyen4919,Tinh Su Huyen Tran           ,Truong Vu4920,Tinh Suong Khoi              ,Hong Ngoc4921,Tinh Suong Khoi              ,Phuong Thanh4922,Tinh Suong Khoi              ,Quang Dung4923,Tinh Ta Tham Thiet           ,Johny Dung4924,Tinh Tham Duyen Que          ,Vu Tuan; Thuy Hang4925,Tinh Tham Muon Mau           ,My Hao4926,Tinh Thien Ly                ,Tuan Dung; Trung Hanh4927,Tinh Thien Thu               ,Thanh Tuyen4928,Tinh Tho                     ,Dam Vinh Hung4929,Tinh Tho                     ,Huy Vu4930,Tinh Thoi Xot Xa             ,Lam Truong4931,Tinh Thoi Xot Xa             ,Minh Tuyet4932,Tinh Thu Cua Linh            ,Elvis Phuong4933,Tinh Thu Cua Linh            ,Gia Huy; Lam Nhat Tien; Le Tam4934,Tinh Thu Cua Linh            ,Le Tri4935,Tinh Thu Cua Linh            ,The Son4936,Tinh Thu Cua Linh            ,Trish Asia44937,Tinh Thu Nhat                ,Chau Hoang Nhung4938,Tinh Toi Moi Lon             ,Loan Chau4939,Tinh Trai Ngang              ,Nhat Trung; La Suong Suong4940,Tinh Tren Non Cao            ,Lucia Kim Chi4941,Tinh Trong Con Mua           ,Nguyen Thang4942,Tinh Trong Di Vang           ,Phi Khanh4943,Tinh Trong Mua               ,Manh Quynh4944,Tinh Trong Nhu Da            ,Vu Van4945,Tinh Tu Mua Xuan             ,Phi Khanh4946,Tinh Tuoi O Mai              ,Tam Doan4947,Tinh Tuoi O Moi              ,Mong Ngoc4948,Tinh Van Chua Yen            ,My Tam4949,Tinh Van Chua Yen            ,Nhat Tinh Anh4950,Tinh Van Hen                 ,Doan Trang4951,Tinh Van Thiet Tha           ,Tuan Ngoc4952,Tinh Vao Thu                 ,Trinh Nam Son4953,Tinh Vo Canh Bay             ,Man4954,Tinh Xa Khuat                ,Nguyen Khuong4955,Tinh Xa Khuat                ,Phuong Thanh4956,Tinh Xa                      ,Thanh Tuyen4957,Tinh Xa                      ,The Bell Band4958,Tinh Xanh                    ,Thanh Thuy4959,Tinh Xot Xa Thoi             ,Le Quang4960,Tinh Xot Xa Thoi             ,My Tam4961,Tinh Xot Xa                  ,Luu Bich4962,Tinh Xua Nghia Cu            ,Quang Linh4963,Tinh Xua Vung Dai            ,Truong Vu4964,Tinh Xua Vung Dai            ,Tuan Canh4965,Tinh Xua Vung Dai            ,Yen Vy4966,Tinh Xua Xa Roi              ,Khanh Ha4967,Tinh Xuan                    ,Hop Ca4968,Tinh Xuan                    ,Manh Dinh4969,Tinh Xuan                    ,Ngoc Bich4970,Tinh Yeu Cach Tro            ,Truong Vu4971,Tinh Yeu Cao Thuong          ,Pham Quynh Anh4972,Tinh Yeu Cho Den Mai Sau     ,Thien Kim4973,Tinh Yeu Co Khi              ,Khanh Ha4974,Tinh Yeu Con Dau             ,Duy Manh4975,Tinh Yeu Con Mai             ,Dam Vinh Hung4976,Tinh Yeu Da Mat              ,Thanh Ha4977,Tinh Yeu Dam Me              ,Lam Truong4978,Tinh Yeu Dam Say             ,Female4979,Tinh Yeu Dau Nam             ,Mai Tuan Yen Khoa4980,Tinh Yeu Den Trong Gia Tu    ,Ho Le Thu4981,Tinh Yeu Den Trong Gia Tu    ,Le Tri4982,Tinh Yeu Dep Nhu The         ,Phan Dinh Tung4983,Tinh Yeu Don Phuong          ,Manh Quynh4984,Tinh Yeu Kho Quen            ,My Le4985,Tinh Yeu Khong Co Anh        ,Son Ca4986,Tinh Yeu Khong Loi           ,Dam Vinh Hung4987,Tinh Yeu Khong Muon Mang     ,Nhat Tinh Anh; Khanh Ngoc4988,Tinh Yeu Khong Tranh Danh    ,Tam Ca4989,Tinh Yeu La Gi               ,Chau Ngoc4990,Tinh Yeu Lua Doi             ,Thanh Thuy4991,Tinh Yeu Lung Linh           ,Tuan Hung4992,Tinh Yeu Mang Theo           ,Nhat Tinh Anh4993,Tinh Yeu Mat Nai             ,Gia Huy4994,Tinh Yeu Mau La Xanh         ,Khanh Dang; Hoang Chau4995,Tinh Yeu Mo Khuat            ,Lili Hue4996,Tinh Yeu Mua Xuan            ,Dam Vinh Hung4997,Tinh Yeu Muon Thuo           ,Thien Kim4998,Tinh Yeu Ngan Cach           ,"Huy Tam, Giao Linh"4999,Tinh Yeu Ngay Ay             ,Cam Ly5000,Tinh Yeu Nhu Bong May        ,Khanh Ly5001,Tinh Yeu Nhu Mui Ten         ,Tuan Ngoc5002,Tinh Yeu Nong Tham           ,Le Toan5003,Tinh Yeu Oi Tinh Yeu         ,Chung Tu Luu5004,Tinh Yeu Oi                  ,Quang Dung5005,Tinh Yeu Tra Lai Trang Sao   ,Hoang Oanh5006,Tinh Yeu Tra Lai Trang Sao   ,Manh Dinh5007,Tinh Yeu Trai Dang           ,Sy Dan5008,Tinh Yeu Tren Dong Song Quan Ho,Phi Nhung5009,Tinh Yeu Tuyet Voi           ,Shayla5010,Tinh Yeu Va Than The         ,Hung Cuong; Mai Le Huyen5011,Tinh Yeu Va Thuy Thu         ,"Huy, Phi Phi"5012,Tinh Yeu Vo Canh             ,Nhu Quynh; Manh Dinh5013,Tinh Yeu                     ,Kieu Nga5014,Tinh                         ,Christiane Le5015,Tinh                         ,Nguyen Khang5016,Tinh                         ,Thanh Truc5017,Tinh                         ,Vpop5018,To Duyen                     ,Truc Quyen5019,To Hong                      ,Female5020,To Hong                      ,Quang Linh; Minh Anh5021,To Tam                       ,Nhu Quynh5022,Toc Em Chua Ua Nang He       ,Thuy Tien5023,Toc Em Duoi Ga               ,Ky Anh5024,Toc Em Duoi Ga               ,Quang Linh